"S31.83","Offene Wunde (jeder Teil des Abdomens, der Lumbosakralgegend und des Beckens) mit Verbindung zu einer intraabdominalen Verletzung"
"S33.50","Verstauchung und Zerrung der Lendenwirbelsäule, nicht näher bezeichnet"
"S36.11","Prellung und Hämatom der Leber"
"S36.49","Verletzung: Sonstiger und mehrere Teile des Dünndarmes"
"S42.10","Fraktur der Skapula: Teil nicht näher bezeichnet"
"S53.40","Verstauchung und Zerrung des Ellenbogens: Teil nicht näher bezeichnet"
"S56.1","Verletzung von Beugemuskeln und -sehnen eines oder mehrerer sonstiger Finger in Höhe des Unterarmes"
"S66.5","Verletzung der kurzen Muskeln und Sehnen sonstiger Finger in Höhe des Handgelenkes und der Hand"
"S82.42","Fraktur der Fibula, isoliert: Schaft"
"S83.51","Verstauchung und Zerrung des Kniegelenkes: Distorsion des vorderen Kreuzbandes"
"S91.1","Offene Wunde einer oder mehrerer Zehen ohne Schädigung des Nagels"
"T07","Nicht näher bezeichnete multiple Verletzungen"
"T21.23","Verbrennung Grad 2a des Rumpfes: Bauchdecke"
"T42.6","Vergiftung: Sonstige Antiepileptika, Sedativa und Hypnotika"
"T80.2","Infektionen nach Infusion, Transfusion oder Injektion zu therapeutischen Zwecken"
"T84.16","Mechanische Komplikation durch eine interne Osteosynthesevorrichtung an Extremitätenknochen: Knöchel und Fuß"
"T84.8","Sonstige Komplikationen durch orthopädische Endoprothesen, Implantate oder Transplantate"
"U51.11","Mittlere kognitive Funktionseinschränkung: Kognitiver FIM: 11-29 Punkte"
"U52.1","Frührehabilitations-Barthel-Index: -75 bis 30 Punkte"
"U60.9","Klinische Kategorie der HIV-Krankheit nicht näher bezeichnet"
"U69.10","Anderenorts klassifizierte Krankheit, für die der Verdacht besteht, dass sie Folge einer medizinisch nicht indizierten ästhetischen Operation, einer Tätowierung oder eines Piercings ist"
"Z30.9","Kontrazeptive Maßnahme, nicht näher bezeichnet"
"Z64.1","Kontaktanlässe mit Bezug auf Multiparität"
"Z76.2","Gesundheitsüberwachung und Betreuung eines anderen gesunden Säuglings und Kindes"
"Z88.9","Allergie gegenüber nicht näher bezeichneten Arzneimitteln, Drogen oder biologisch aktiven Substanzen in der Eigenanamnese"
"Z90.3","Verlust von Teilen des Magens"
"Z91.72","Weibliche Genitalverstümmelung in der Eigenanamnese, Typ 2"
"Z94.5","Zustand nach Hauttransplantation"
"Z94.88","Zustand nach sonstiger Organ- oder Gewebetransplantation"
"Z96.64","Vorhandensein einer Hüftgelenkprothese"
"Z98.1","Zustand nach Arthrodese"
"---","Rest (2.526 Zeilen)"
"K43.2","Narbenhernie ohne Einklemmung und ohne Gangrän"
"K64.3","Hämorrhoiden 4. Grades"
"M94.86","Sonstige näher bezeichnete Knorpelkrankheiten: Unterschenkel [Fibula, Tibia, Kniegelenk]"
"O04.4","Ärztlich eingeleiteter Abort: Inkomplett, ohne Komplikation"
"C50.8","Bösartige Neubildung: Brustdrüse, mehrere Teilbereiche überlappend"
"M54.17","Radikulopathie: Lumbosakralbereich"
"S83.50","Verstauchung und Zerrung des Kniegelenkes: Nicht näher bezeichnetes Kreuzband"
"I33.0","Akute und subakute infektiöse Endokarditis"
"Q18.8","Sonstige näher bezeichnete angeborene Fehlbildungen des Gesichtes und des Halses"
"D12.6","Gutartige Neubildung: Kolon, nicht näher bezeichnet"
"E65","Lokalisierte Adipositas"
"K10.28","Sonstige näher bezeichnete entzündliche Zustände der Kiefer"
"K40.30","Hernia inguinalis, einseitig oder ohne Seitenangabe, mit Einklemmung, ohne Gangrän: Nicht als Rezidivhernie bezeichnet"
"K57.22","Divertikulitis des Dickdarmes mit Perforation und Abszess, ohne Angabe einer Blutung"
"N99.1","Harnröhrenstriktur nach medizinischen Maßnahmen"
"Q82.5","Angeborener nichtneoplastischer Nävus"
"D17.1","Gutartige Neubildung des Fettgewebes der Haut und der Unterhaut des Rumpfes"
"D36.1","Gutartige Neubildung: Periphere Nerven und autonomes Nervensystem"
"H11.0","Pterygium"
"I48.1","Vorhofflimmern, persistierend"
"J38.1","Polyp der Stimmlippen und des Kehlkopfes"
"K02.1","Karies des Dentins"
"K04.7","Periapikaler Abszess ohne Fistel"
"K22.0","Achalasie der Kardia"
"M24.66","Ankylose eines Gelenkes: Unterschenkel [Fibula, Tibia, Kniegelenk]"
"N48.2","Sonstige entzündliche Krankheiten des Penis"
"O05.1","Sonstiger Abort: Inkomplett, kompliziert durch Spätblutung oder verstärkte Blutung"
"S66.2","Verletzung der Streckmuskeln und -sehnen des Daumens in Höhe des Handgelenkes und der Hand"
"B02.1","Zoster-Meningitis"
"C49.5","Bösartige Neubildung: Bindegewebe und andere Weichteilgewebe des Beckens"
"C71.0","Bösartige Neubildung: Zerebrum, ausgenommen Hirnlappen und Ventrikel"
"D18.01","Hämangiom: Haut und Unterhaut"
"D18.02","Hämangiom: Intrakraniell"
"D43.0","Neubildung unsicheren oder unbekannten Verhaltens: Gehirn, supratentoriell"
"G41.2","Status epilepticus mit komplexfokalen Anfällen"
"H33.0","Netzhautablösung mit Netzhautriss"
"H81.3","Sonstiger peripherer Schwindel"
"H81.8","Sonstige Störungen der Vestibularfunktion"
"I20.8","Sonstige Formen der Angina pectoris"
"J02.8","Akute Pharyngitis durch sonstige näher bezeichnete Erreger"
"K61.4","Intrasphinktärer Abszess"
"K81.1","Chronische Cholezystitis"
"M05.80","Sonstige seropositive chronische Polyarthritis: Mehrere Lokalisationen"
"M45.00","Spondylitis ankylosans: Mehrere Lokalisationen der Wirbelsäule"
"M65.14","Sonstige infektiöse (Teno-)Synovitis: Hand [Finger, Handwurzel, Mittelhand, Gelenke zwischen diesen Knochen]"
"M75.2","Tendinitis des M. biceps brachii"
"N20.9","Harnstein, nicht näher bezeichnet"
"N36.8","Sonstige näher bezeichnete Krankheiten der Harnröhre"
"N80.5","Endometriose des Darmes"
"Q65.4","Angeborene Subluxation des Hüftgelenkes, beidseitig"
"T88.6","Anaphylaktischer Schock als unerwünschte Nebenwirkung eines indikationsgerechten Arzneimittels oder einer indikationsgerechten Droge bei ordnungsgemäßer Verabreichung"
"B00.0","Ekzema herpeticatum Kaposi"
"B00.5","Augenkrankheit durch Herpesviren"
"B08.4","Vesikuläre Stomatitis mit Exanthem durch Enteroviren"
"C18.1","Bösartige Neubildung: Appendix vermiformis"
"C43.7","Bösartiges Melanom der unteren Extremität, einschließlich Hüfte"
"C49.1","Bösartige Neubildung: Bindegewebe und andere Weichteilgewebe der oberen Extremität, einschließlich Schulter"
"C53.9","Bösartige Neubildung: Cervix uteri, nicht näher bezeichnet"
"C74.0","Bösartige Neubildung: Nebennierenrinde"
"D16.1","Gutartige Neubildung des Knochens und des Gelenkknorpels: Kurze Knochen der oberen Extremität"
"D32.0","Gutartige Neubildung: Hirnhäute"
"D86.2","Sarkoidose der Lunge mit Sarkoidose der Lymphknoten"
"E27.2","Addison-Krise"
"F23.9","Akute vorübergehende psychotische Störung, nicht näher bezeichnet"
"G06.0","Intrakranieller Abszess und intrakranielles Granulom"
"G50.0","Trigeminusneuralgie"
"H02.4","Ptosis des Augenlides"
"H04.5","Stenose und Insuffizienz der Tränenwege"
"H33.4","Traktionsablösung der Netzhaut"
"H66.2","Chronische epitympanale Otitis media"
"H81.0","Ménière-Krankheit"
"H81.9","Störung der Vestibularfunktion, nicht näher bezeichnet"
"I27.0","Primäre pulmonale Hypertonie"
"I61.0","Intrazerebrale Blutung in die Großhirnhemisphäre, subkortikal"
"I83.1","Varizen der unteren Extremitäten mit Entzündung"
"K11.5","Sialolithiasis"
"K52.2","Allergische und alimentäre Gastroenteritis und Kolitis"
"K61.3","Ischiorektalabszess"
"L40.4","Psoriasis guttata"
"L97","Ulcus cruris, anderenorts nicht klassifiziert"
"L98.7","Überschüssige und erschlaffte Haut und Unterhaut"
"M20.2","Hallux rigidus"
"M35.9","Krankheit mit Systembeteiligung des Bindegewebes, nicht näher bezeichnet"
"M51.0","Lumbale und sonstige Bandscheibenschäden mit Myelopathie"
"M84.16","Nichtvereinigung der Frakturenden [Pseudarthrose]: Unterschenkel [Fibula, Tibia, Kniegelenk]"
"M86.65","Sonstige chronische Osteomyelitis: Beckenregion und Oberschenkel [Becken, Femur, Gesäß, Hüfte, Hüftgelenk, Iliosakralgelenk]"
"M89.04","Neurodystrophie [Algodystrophie]: Hand [Finger, Handwurzel, Mittelhand, Gelenke zwischen diesen Knochen]"
"N75.0","Bartholin-Zyste"
"N97.9","Sterilität der Frau, nicht näher bezeichnet"
"O00.9","Extrauteringravidität, nicht näher bezeichnet"
"O24.1","Diabetes mellitus in der Schwangerschaft: Vorher bestehender Diabetes mellitus, Typ 2"
"O35.0","Betreuung der Mutter bei (Verdacht auf) Fehlbildung des Zentralnervensystems beim Fetus"
"O42.12","Vorzeitiger Blasensprung, Wehenbeginn nach Ablauf von mehr als 7 Tagen"
"O42.22","Vorzeitiger Blasensprung, Wehenhemmung durch Therapie, Wehenbeginn nach Ablauf von mehr als 7 Tagen"
"O91.11","Abszess der Mamma im Zusammenhang mit der Gestation: Mit Angabe von Schwierigkeiten beim Anlegen"
"Q28.28","Sonstige angeborene arteriovenöse Fehlbildungen der zerebralen Gefäße"
"Q30.2","Nasenfurche, Naseneinkerbung und Spaltnase"
"S42.29","Fraktur des proximalen Endes des Humerus: Sonstige und multiple Teile"
"S62.4","Multiple Frakturen der Mittelhandknochen"
"T43.3","Vergiftung: Antipsychotika und Neuroleptika auf Phenothiazin-Basis"
"---","Rest (1.928 Zeilen)"
"F41.8","Sonstige spezifische Angststörungen"
"Q67.4","Sonstige angeborene Deformitäten des Schädels, des Gesichtes und des Kiefers"
"M65.97","Synovitis und Tenosynovitis, nicht näher bezeichnet: Knöchel und Fuß [Fußwurzel, Mittelfuß, Zehen, Sprunggelenk, sonstige Gelenke des Fußes]"
"F60.9","Persönlichkeitsstörung, nicht näher bezeichnet"
"N94.1","Dyspareunie"
"O34.4","Betreuung der Mutter bei sonstigen Anomalien der Cervix uteri"
"O35.1","Betreuung der Mutter bei (Verdacht auf) Chromosomenanomalie beim Fetus"
"R49.0","Dysphonie"
"Z98.0","Zustand nach intestinalem Bypass oder intestinaler Anastomose"
"I97.88","Lymphödem nach medizinischen Maßnahmen, sonstige Lokalisationen, alle Stadien"
"Z95.5","Vorhandensein eines Implantates oder Transplantates nach koronarer Gefäßplastik"
"N94.8","Sonstige näher bezeichnete Zustände im Zusammenhang mit den weiblichen Genitalorganen und dem Menstruationszyklus"
"O74.5","Kopfschmerzen nach Spinal- oder Periduralanästhesie während der Wehentätigkeit und bei der Entbindung"
"H04.1","Sonstige Affektionen der Tränendrüse"
"H70.1","Chronische Mastoiditis"
"I07.1","Trikuspidalklappeninsuffizienz"
"K04.5","Chronische apikale Parodontitis"
"K64.8","Sonstige Hämorrhoiden"
"M23.23","Meniskusschädigung durch alten Riss oder alte Verletzung: Sonstiger und nicht näher bezeichneter Teil des Innenmeniskus"
"M94.27","Chondromalazie: Knöchel und Fuß [Fußwurzel, Mittelfuß, Zehen, Sprunggelenk, sonstige Gelenke des Fußes]"
"R04.8","Blutung aus sonstigen Lokalisationen in den Atemwegen"
"U60.3","Klinische Kategorien der HIV-Krankheit: Kategorie C"
"Z85.3","Bösartige Neubildung der Brustdrüse [Mamma] in der Eigenanamnese"
"D56.9","Thalassämie, nicht näher bezeichnet"
"A74.9","Chlamydieninfektion, nicht näher bezeichnet"
"C78.2","Sekundäre bösartige Neubildung der Pleura"
"D69.41","Sonstige primäre Thrombozytopenie, nicht als transfusionsrefraktär bezeichnet"
"F07.2","Organisches Psychosyndrom nach Schädelhirntrauma"
"F20.8","Sonstige Schizophrenie"
"G82.61","Funktionale Höhe der Schädigung des Rückenmarkes: C4-C5"
"I25.11","Atherosklerotische Herzkrankheit: Ein-Gefäß-Erkrankung"
"J98.7","Infektion der Atemwege, anderenorts nicht klassifiziert"
"K31.7","Polyp des Magens und des Duodenums"
"K71.0","Toxische Leberkrankheit mit Cholestase"
"O16","Nicht näher bezeichnete Hypertonie der Mutter"
"O32.0","Betreuung der Mutter wegen wechselnder Kindslage"
"R45.0","Nervosität"
"S21.85","Weichteilschaden II. Grades bei geschlossener Fraktur oder Luxation des Thorax"
"T92.1","Folgen einer Fraktur des Armes"
"T93.3","Folgen einer Luxation, Verstauchung oder Zerrung der unteren Extremität"
"Z80.0","Bösartige Neubildung der Verdauungsorgane in der Familienanamnese"
"K91.83","Insuffizienzen von Anastomosen und Nähten nach Operationen am sonstigen Verdauungstrakt"
"O60.2","Vorzeitige Wehen mit termingerechter Entbindung"
"A56.1","Chlamydieninfektion des Pelviperitoneums und sonstiger Urogenitalorgane"
"D25.2","Subseröses Leiomyom des Uterus"
"M41.25","Sonstige idiopathische Skoliose: Thorakolumbalbereich"
"M94.25","Chondromalazie: Beckenregion und Oberschenkel [Becken, Femur, Gesäß, Hüfte, Hüftgelenk, Iliosakralgelenk]"
"Q51.8","Sonstige angeborene Fehlbildungen des Uterus und der Cervix uteri"
"B95.42","Streptokokken, Gruppe G, als Ursache von Krankheiten, die in anderen Kapiteln klassifiziert sind"
"D12.5","Gutartige Neubildung: Colon sigmoideum"
"D17.6","Gutartige Neubildung des Fettgewebes des Samenstrangs"
"D34","Gutartige Neubildung der Schilddrüse"
"F22.0","Wahnhafte Störung"
"F42.1","Vorwiegend Zwangshandlungen [Zwangsrituale]"
"G47.39","Schlafapnoe, nicht näher bezeichnet"
"G82.42","Spastische Tetraparese und Tetraplegie: Chronische komplette Querschnittlähmung"
"G82.62","Funktionale Höhe der Schädigung des Rückenmarkes: C6-C8"
"H18.2","Sonstiges Hornhautödem"
"H72.9","Trommelfellperforation, nicht näher bezeichnet"
"I79.2","Periphere Angiopathie bei anderenorts klassifizierten Krankheiten"
"J33.9","Nasenpolyp, nicht näher bezeichnet"
"M20.3","Sonstige Deformität der Großzehe (erworben)"
"M20.4","Sonstige Hammerzehe(n) (erworben)"
"M25.77","Osteophyt: Knöchel und Fuß [Fußwurzel, Mittelfuß, Zehen, Sprunggelenk, sonstige Gelenke des Fußes]"
"M45.09","Spondylitis ankylosans: Nicht näher bezeichnete Lokalisation"
"M65.85","Sonstige Synovitis und Tenosynovitis: Beckenregion und Oberschenkel [Becken, Femur, Gesäß, Hüfte, Hüftgelenk, Iliosakralgelenk]"
"N84.0","Polyp des Corpus uteri"
"O26.1","Geringe Gewichtszunahme in der Schwangerschaft"
"O26.2","Schwangerschaftsbetreuung bei Neigung zu habituellem Abort"
"O35.5","Betreuung der Mutter bei (Verdacht auf) Schädigung des Fetus durch Arzneimittel oder Drogen"
"O61.8","Sonstige misslungene Geburtseinleitung"
"O66.4","Misslungener Versuch der Geburtsbeendigung, nicht näher bezeichnet"
"Q43.1","Hirschsprung-Krankheit"
"Q51.2","Sonstige Formen des Uterus duplex"
"R43.8","Sonstige und nicht näher bezeichnete Störungen des Geruchs- und Geschmackssinnes"
"S01.83","Offene Wunde (jeder Teil des Kopfes) mit Verbindung zu einer intrakraniellen Verletzung"
"S52.02","Fraktur des proximalen Endes der Ulna: Processus coronoideus ulnae"
"S53.2","Traumatische Ruptur des Lig. collaterale radiale"
"S76.4","Verletzung sonstiger und nicht näher bezeichneter Muskeln und Sehnen in Höhe des Oberschenkels"
"T84.15","Mechanische Komplikation durch eine interne Osteosynthesevorrichtung an Extremitätenknochen: Unterschenkel"
"Z36.4","Pränatales Screening auf fetale Wachstumsretardierung mittels Ultraschall oder anderer physikalischer Verfahren"
"Z45.01","Anpassung und Handhabung eines implantierten Kardiodefibrillators"
"Z90.0","Verlust von Teilen des Kopfes oder des Halses"
"Z90.8","Verlust sonstiger Organe"
"N80.2","Endometriose der Tuba uterina"
"Y82.8","Zwischenfälle durch medizintechnische Geräte und Produkte"
"G82.63","Funktionale Höhe der Schädigung des Rückenmarkes: T1-T6"
"I44.7","Linksschenkelblock, nicht näher bezeichnet"
"J18.2","Hypostatische Pneumonie, nicht näher bezeichnet"
"N76.2","Akute Vulvitis"
"O70.3","Dammriss 4. Grades unter der Geburt"
"Z31.4","Untersuchung und Test im Zusammenhang mit Fertilisation"
"Z54.0","Rekonvaleszenz nach chirurgischem Eingriff"
"Z96.65","Vorhandensein einer Kniegelenkprothese"
"C77.5","Sekundäre und nicht näher bezeichnete bösartige Neubildung: Intrapelvine Lymphknoten"
"D12.2","Gutartige Neubildung: Colon ascendens"
"D22.6","Melanozytennävus der oberen Extremität, einschließlich Schulter"
"D37.0","Neubildung unsicheren oder unbekannten Verhaltens: Lippe, Mundhöhle und Pharynx"
"D37.6","Neubildung unsicheren oder unbekannten Verhaltens: Leber, Gallenblase und Gallengänge"
"D56.8","Sonstige Thalassämien"
"D61.9","Aplastische Anämie, nicht näher bezeichnet"
"D68.35","Hämorrhagische Diathese durch sonstige Antikoagulanzien"
"E01.8","Sonstige jodmangelbedingte Schilddrüsenkrankheiten und verwandte Zustände"
"E29.1","Testikuläre Unterfunktion"
"F25.9","Schizoaffektive Störung, nicht näher bezeichnet"
"F61","Kombinierte und andere Persönlichkeitsstörungen"
"G47.30","Zentrales Schlafapnoe-Syndrom"
"G93.9","Krankheit des Gehirns, nicht näher bezeichnet"
"G95.84","Detrusor-Sphinkter-Dyssynergie bei Schädigungen des Rückenmarkes"
"H19.1","Keratitis und Keratokonjunktivitis durch Herpesviren"
"H65.1","Sonstige akute nichteitrige Otitis media"
"I35.0","Aortenklappenstenose"
"I67.88","Sonstige näher bezeichnete zerebrovaskuläre Krankheiten"
"I87.1","Venenkompression"
"J31.2","Chronische Pharyngitis"
"J35.8","Sonstige chronische Krankheiten der Gaumenmandeln und der Rachenmandel"
"J44.89","Sonstige näher bezeichnete chronische obstruktive Lungenkrankheit: FEV1 nicht näher bezeichnet"
"K13.7","Sonstige und nicht näher bezeichnete Läsionen der Mundschleimhaut"
"K60.4","Rektalfistel"
"K62.0","Analpolyp"
"K76.1","Chronische Stauungsleber"
"K91.4","Funktionsstörung nach Kolostomie oder Enterostomie"
"L73.9","Krankheit der Haarfollikel, nicht näher bezeichnet"
"L74.8","Sonstige Krankheiten der ekkrinen Schweißdrüsen"
"L93.0","Diskoider Lupus erythematodes"
"M23.26","Meniskusschädigung durch alten Riss oder alte Verletzung: Sonstiger und nicht näher bezeichneter Teil des Außenmeniskus"
"M23.34","Sonstige Meniskusschädigungen: Vorderhorn des Außenmeniskus"
"M23.50","Chronische Instabilität des Kniegelenkes: Mehrere Lokalisationen"
"M40.46","Sonstige Lordose: Lumbalbereich"
"M54.12","Radikulopathie: Zervikalbereich"
"M67.46","Ganglion: Unterschenkel [Fibula, Tibia, Kniegelenk]"
"M94.96","Knorpelkrankheit, nicht näher bezeichnet: Unterschenkel [Fibula, Tibia, Kniegelenk]"
"N39.40","Reflexinkontinenz"
"N80.6","Endometriose in Hautnarbe"
"O26.3","Schwangerschaft bei liegendem Intrauterinpessar"
"O32.4","Betreuung der Mutter bei Nichteintreten des Kopfes zum Termin"
"Q22.4","Angeborene Trikuspidalklappenstenose"
"Q51.3","Uterus bicornis"
"Q89.3","Situs inversus"
"R39.0","Urin-Extravasation"
"R44.1","Optische Halluzinationen"
"R57.8","Sonstige Formen des Schocks"
"R87.6","Abnorme Befunde in Untersuchungsmaterialien aus den weiblichen Genitalorganen: Abnorme zytologische Befunde"
"R90.0","Intrakranielle Raumforderung"
"S90.84","Sonstige oberflächliche Verletzungen der Knöchelregion und des Fußes: Oberflächlicher Fremdkörper (Splitter)"
"T81.1","Schock während oder als Folge eines Eingriffes, anderenorts nicht klassifiziert"
"T88.4","Misslungene oder schwierige Intubation"
"T90.2","Folgen einer Fraktur des Schädels und der Gesichtsschädelknochen"
"T92.0","Folgen einer offenen Wunde der oberen Extremität"
"T95.2","Folgen einer Verbrennung, Verätzung oder Erfrierung der oberen Extremität"
"U81.6","Burkholderia, Stenotrophomonas und andere Nonfermenter mit Resistenz gegen Chinolone, Amikacin, Ceftazidim, Piperacillin/Tazobactam oder Cotrimoxazol"
"Z30.8","Sonstige kontrazeptive Maßnahmen"
"Z49.0","Vorbereitung auf die Dialyse"
"Z50.5","Logopädische Behandlung [Therapie von Stimm-, Sprech- und Sprachstörungen]"
"Z51.5","Palliativbehandlung"
"Z56","Kontaktanlässe mit Bezug auf das Berufsleben"
"Z94.2","Zustand nach Lungentransplantation"
"D12.8","Gutartige Neubildung: Rektum"
"J86.0","Pyothorax mit Fistel"
"U80.20","Enterococcus faecalis mit Resistenz gegen Glykopeptid-Antibiotika"
"D68.33","Hämorrhagische Diathese durch Cumarine (Vitamin-K-Antagonisten)"
"E10.21","Diabetes mellitus, Typ 1: Mit Nierenkomplikationen: Als entgleist bezeichnet"
"G06.2","Extraduraler und subduraler Abszess, nicht näher bezeichnet"
"H35.3","Degeneration der Makula und des hinteren Poles"
"J41.0","Einfache chronische Bronchitis"
"J84.1","Sonstige interstitielle Lungenkrankheiten mit Fibrose"
"K70.3","Alkoholische Leberzirrhose"
"K70.9","Alkoholische Leberkrankheit, nicht näher bezeichnet"
"O26.4","Herpes gestationis"
"O92.41","Hypogalaktie: Mit Angabe von Schwierigkeiten beim Anlegen"
"R65.3","Systemisches inflammatorisches Response-Syndrom [SIRS] nichtinfektiöser Genese mit Organkomplikationen"
"T79.8","Sonstige Frühkomplikationen eines Traumas"
"T83.8","Sonstige Komplikationen durch Prothesen, Implantate oder Transplantate im Urogenitaltrakt"
"A04.8","Sonstige näher bezeichnete bakterielle Darminfektionen"
"B37.1","Kandidose der Lunge"
"B95.3","Streptococcus pneumoniae als Ursache von Krankheiten, die in anderen Kapiteln klassifiziert sind"
"D10.3","Gutartige Neubildung: Sonstige und nicht näher bezeichnete Teile des Mundes"
"D51.8","Sonstige Vitamin-B12-Mangelanämien"
"D52.0","Alimentäre Folsäure-Mangelanämie"
"D53.8","Sonstige näher bezeichnete alimentäre Anämien"
"D59.1","Sonstige autoimmunhämolytische Anämien"
"D65.2","Erworbene Fibrinolyseblutung"
"D69.57","Sonstige sekundäre Thrombozytopenien, als transfusionsrefraktär bezeichnet"
"D86.8","Sarkoidose an sonstigen und kombinierten Lokalisationen"
"E04.9","Nichttoxische Struma, nicht näher bezeichnet"
"E56.8","Mangel an sonstigen Vitaminen"
"E75.2","Sonstige Sphingolipidosen"
"E83.0","Störungen des Kupferstoffwechsels"
"F07.0","Organische Persönlichkeitsstörung"
"F34.1","Dysthymia"
"F39","Nicht näher bezeichnete affektive Störung"
"F55.2","Schädlicher Gebrauch von nichtabhängigkeitserzeugenden Substanzen: Analgetika"
"G47.38","Sonstige Schlafapnoe"
"G55.2","Kompression von Nervenwurzeln und Nervenplexus bei Spondylose"
"G72.80","Critical-illness-Myopathie"
"G82.02","Schlaffe Paraparese und Paraplegie: Chronische komplette Querschnittlähmung"
"G82.09","Schlaffe Paraparese und Paraplegie: Nicht näher bezeichnet"
"G82.19","Spastische Paraparese und Paraplegie: Nicht näher bezeichnet"
"G82.33","Schlaffe Tetraparese und Tetraplegie: Chronische inkomplette Querschnittlähmung"
"G82.52","Tetraparese und Tetraplegie, nicht näher bezeichnet: Chronische komplette Querschnittlähmung"
"G82.65","Funktionale Höhe der Schädigung des Rückenmarkes: T11-L1"
"G83.6","Zentrale faziale Parese"
"G97.80","Postoperative Liquorfistel"
"H10.9","Konjunktivitis, nicht näher bezeichnet"
"H11.8","Sonstige näher bezeichnete Affektionen der Konjunktiva"
"H35.0","Retinopathien des Augenhintergrundes und Veränderungen der Netzhautgefäße"
"H50.8","Sonstiger näher bezeichneter Strabismus"
"H65.0","Akute seröse Otitis media"
"H90.0","Beidseitiger Hörverlust durch Schallleitungsstörung"
"I08.1","Krankheiten der Mitral- und Trikuspidalklappe, kombiniert"
"I11.00","Hypertensive Herzkrankheit mit (kongestiver) Herzinsuffizienz: Ohne Angabe einer hypertensiven Krise"
"I45.8","Sonstige näher bezeichnete kardiale Erregungsleitungsstörungen"
"I50.02","Rechtsherzinsuffizienz ohne Beschwerden"
"I50.04","Rechtsherzinsuffizienz mit Beschwerden bei leichterer Belastung"
"I50.19","Linksherzinsuffizienz: Nicht näher bezeichnet"
"I89.00","Lymphödem der oberen und unteren Extremität(en), Stadium I"
"J17.1","Pneumonie bei anderenorts klassifizierten Viruskrankheiten"
"J38.4","Larynxödem"
"J95.1","Akute pulmonale Insuffizienz nach Thoraxoperation"
"J98.6","Krankheiten des Zwerchfells"
"K43.90","Epigastrische Hernie ohne Einklemmung und ohne Gangrän"
"K62.9","Krankheit des Anus und des Rektums, nicht näher bezeichnet"
"K63.0","Darmabszess"
"K63.3","Darmulkus"
"K65.9","Peritonitis, nicht näher bezeichnet"
"K91.3","Postoperativer Darmverschluss"
"K93.0","Tuberkulose des Darmes, des Peritoneums und der Mesenteriallymphknoten"
"L03.8","Phlegmone an sonstigen Lokalisationen"
"L23.3","Allergische Kontaktdermatitis durch Drogen oder Arzneimittel bei Hautkontakt"
"L23.8","Allergische Kontaktdermatitis durch sonstige Agenzien"
"L30.4","Intertriginöses Ekzem"
"L54.8","Erythem bei sonstigen anderenorts klassifizierten Krankheiten"
"M14.80","Arthropathien bei sonstigen näher bezeichneten, anderenorts klassifizierten Krankheiten: Mehrere Lokalisationen"
"M23.30","Sonstige Meniskusschädigungen: Mehrere Lokalisationen"
"M23.31","Sonstige Meniskusschädigungen: Vorderhorn des Innenmeniskus"
"M24.11","Sonstige Gelenkknorpelschädigungen: Schulterregion [Klavikula, Skapula, Akromioklavikular-, Schulter-, Sternoklavikulargelenk]"
"M25.85","Sonstige näher bezeichnete Gelenkkrankheiten: Beckenregion und Oberschenkel [Becken, Femur, Gesäß, Hüfte, Hüftgelenk, Iliosakralgelenk]"
"M41.49","Neuromyopathische Skoliose: Nicht näher bezeichnete Lokalisation"
"M42.10","Osteochondrose der Wirbelsäule beim Erwachsenen: Mehrere Lokalisationen der Wirbelsäule"
"M48.02","Spinal(kanal)stenose: Zervikalbereich"
"M75.1","Läsionen der Rotatorenmanschette"
"M81.99","Osteoporose, nicht näher bezeichnet: Nicht näher bezeichnete Lokalisation"
"M96.1","Postlaminektomie-Syndrom, anderenorts nicht klassifiziert"
"N13.4","Hydroureter"
"N17.82","Sonstiges akutes Nierenversagen: Stadium 2"
"N31.2","Schlaffe neurogene Harnblase, anderenorts nicht klassifiziert"
"N35.9","Harnröhrenstriktur, nicht näher bezeichnet"
"N60.3","Fibrosklerose der Mamma"
"N88.2","Striktur und Stenose der Cervix uteri"
"O34.7","Betreuung der Mutter bei Anomalie der Vulva und des Perineums"
"O41.9","Veränderung des Fruchtwassers und der Eihäute, nicht näher bezeichnet"
"O65.1","Geburtshindernis durch allgemein verengtes Becken"
"O98.7","HIV-Krankheit [Humane Immundefizienz-Viruskrankheit], die Schwangerschaft, Geburt und Wochenbett kompliziert"
"Q03.9","Angeborener Hydrozephalus, nicht näher bezeichnet"
"Q05.7","Lumbale Spina bifida ohne Hydrozephalus"
"Q20.3","Diskordante ventrikuloarterielle Verbindung"
"Q82.2","Mastozytose (angeboren)"
"R22.2","Lokalisierte Schwellung, Raumforderung und Knoten der Haut und der Unterhaut am Rumpf"
"R29.2","Abnorme Reflexe"
"R50.2","Medikamenten-induziertes Fieber [Drug fever]"
"R61.0","Hyperhidrose, umschrieben"
"R93.8","Abnorme Befunde bei der bildgebenden Diagnostik an sonstigen näher bezeichneten Körperstrukturen"
"S09.9","Nicht näher bezeichnete Verletzung des Kopfes"
"S20.85","Oberflächliche Verletzung sonstiger und nicht näher bezeichneter Teile des Thorax: Prellung"
"S37.6","Verletzung des Uterus"
