"E71.3","Störungen des Fettsäurestoffwechsels"
"M07.34","Sonstige psoriatische Arthritiden: Hand [Finger, Handwurzel, Mittelhand, Gelenke zwischen diesen Knochen]"
"R02.01","Nekrose der Haut und Unterhaut, anderenorts nicht klassifiziert: Schulterregion, Oberarm und Ellenbogen"
"M05.84","Sonstige seropositive chronische Polyarthritis: Hand [Finger, Handwurzel, Mittelhand, Gelenke zwischen diesen Knochen]"
"M66.24","Spontanruptur von Strecksehnen: Hand [Finger, Handwurzel, Mittelhand, Gelenke zwischen diesen Knochen]"
"S42.19","Fraktur der Skapula: Multipel"
"C67.0","Bösartige Neubildung: Trigonum vesicae"
"M49.50","Wirbelkörperkompression bei anderenorts klassifizierten Krankheiten: Mehrere Lokalisationen der Wirbelsäule"
"R76.9","Abnormer immunologischer Serumbefund, nicht näher bezeichnet"
"G92.9","Sonstige und nicht näher bezeichnete toxische Enzephalopathie"
"H83.1","Labyrinthfistel"
"I24.0","Koronarthrombose ohne nachfolgenden Myokardinfarkt"
"M85.47","Solitäre Knochenzyste: Knöchel und Fuß [Fußwurzel, Mittelfuß, Zehen, Sprunggelenk, sonstige Gelenke des Fußes]"
"---","Rest (2.811 Zeilen)"
"C60.1","Bösartige Neubildung: Glans penis"
"---","Rest (1.962 Zeilen)"
"C17.1","Bösartige Neubildung: Jejunum"
"I66.4","Verschluss und Stenose mehrerer und beidseitiger zerebraler Arterien"
"M24.22","Krankheiten der Bänder: Oberarm [Humerus, Ellenbogengelenk]"
"C82.9","Follikuläres Lymphom, nicht näher bezeichnet"
"T84.06","Mechanische Komplikation durch eine Gelenkendoprothese: Sprunggelenk"
"---","Rest (1.870 Zeilen)"
"D69.52","Heparin-induzierte Thrombozytopenie Typ I"
"L24.9","Toxische Kontaktdermatitis, nicht näher bezeichnete Ursache"
"M80.88","Sonstige Osteoporose mit pathologischer Fraktur: Sonstige [Hals, Kopf, Rippen, Rumpf, Schädel, Wirbelsäule]"
"M84.26","Verzögerte Frakturheilung: Unterschenkel [Fibula, Tibia, Kniegelenk]"
"C16.4","Bösartige Neubildung: Pylorus"
"C70.0","Bösartige Neubildung: Hirnhäute"
"D07.2","Carcinoma in situ: Vagina"
"---","Rest (1.779 Zeilen)"
"U81.43","Sonstige Klebsiellen mit Multiresistenz 4MRGN"
"C13.9","Bösartige Neubildung: Hypopharynx, nicht näher bezeichnet"
"K93.41","Stadium 1 der chronischen Mundschleimhaut-Graft-versus-Host-Krankheit"
"---","Rest (2.657 Zeilen)"
"---","Rest (993 Zeilen)"
"---","Rest (1.623 Zeilen)"
"D51.0","Vitamin-B12-Mangelanämie durch Mangel an Intrinsic-Faktor"
"---","Rest (1.368 Zeilen)"
"U07.5","Multisystemisches Entzündungssyndrom in Verbindung mit COVID-19, nicht näher bezeichnet"
"---","Rest (2.165 Zeilen)"
"C50.6","Bösartige Neubildung: Recessus axillaris der Brustdrüse"
"M94.99","Knorpelkrankheit, nicht näher bezeichnet: Nicht näher bezeichnete Lokalisation"
"M96.82","Verzögerte Knochenheilung nach Fusion oder Arthrodese"
"M99.51","Stenose des Spinalkanals durch Bandscheiben: Zervikalbereich [zervikothorakal]"
"N27.0","Kleine Niere unbekannter Ursache, einseitig"
"C54.9","Bösartige Neubildung: Corpus uteri, nicht näher bezeichnet"
"F00.0","Demenz bei Alzheimer-Krankheit, mit frühem Beginn (Typ 2)"
"L94.3","Sklerodaktylie"
"M47.89","Sonstige Spondylose: Nicht näher bezeichnete Lokalisation"
"M66.31","Spontanruptur von Beugesehnen: Schulterregion [Klavikula, Skapula, Akromioklavikular-, Schulter-, Sternoklavikulargelenk]"
"S37.38","Verletzung der Harnröhre: Sonstige Teile"
"---","Rest (2.691 Zeilen)"
"---","Rest (1.881 Zeilen)"
"M13.13","Monarthritis, anderenorts nicht klassifiziert: Unterarm [Radius, Ulna, Handgelenk]"
"M23.06","Meniskusganglion: Sonstiger und nicht näher bezeichneter Teil des Außenmeniskus"
"N42.8","Sonstige näher bezeichnete Krankheiten der Prostata"
"Q66.3","Sonstige angeborene Varusdeformitäten der Füße"
"---","Rest (2.729 Zeilen)"
"M40.14","Sonstige sekundäre Kyphose: Thorakalbereich"
"I34.80","Nichtrheumatische Mitralklappenstenose mit Mitralklappeninsuffizienz"
"D41.1","Neubildung unsicheren oder unbekannten Verhaltens: Nierenbecken"
"---","Rest (1.910 Zeilen)"
"U81.51","Acinetobacter-baumannii-Gruppe mit Multiresistenz 4MRGN"
"J38.03","Lähmung der Stimmlippen und des Kehlkopfes: Beidseitig, partiell"
"---","Rest (2.690 Zeilen)"
"K43.1","Narbenhernie mit Gangrän"
"M86.86","Sonstige Osteomyelitis: Unterschenkel [Fibula, Tibia, Kniegelenk]"
"F06.6","Organische emotional labile [asthenische] Störung"
"M13.11","Monarthritis, anderenorts nicht klassifiziert: Schulterregion [Klavikula, Skapula, Akromioklavikular-, Schulter-, Sternoklavikulargelenk]"
"S63.10","Luxation eines Fingers: Teil nicht näher bezeichnet"
"A51.4","Sonstige sekundäre Syphilis"
"F28","Sonstige nichtorganische psychotische Störungen"
"I68.0","Zerebrale Amyloidangiopathie"
"B94.9","Folgezustände nicht näher bezeichneter infektiöser oder parasitärer Krankheit"
"G97.82","Postoperative epidurale spinale Blutung"
"M24.47","Habituelle Luxation und Subluxation eines Gelenkes: Knöchel und Fuß [Fußwurzel, Mittelfuß, Zehen, Sprunggelenk, sonstige Gelenke des Fußes]"
"M60.99","Myositis, nicht näher bezeichnet: Nicht näher bezeichnete Lokalisation"
"R39.2","Extrarenale Urämie"
"U51.12","Mittlere kognitive Funktionseinschränkung: MMSE: 17-23 Punkte"
"C10.2","Bösartige Neubildung: Seitenwand des Oropharynx"
"---","Rest (1.935 Zeilen)"
"J15.3","Pneumonie durch Streptokokken der Gruppe B"
"A52.3","Neurosyphilis, nicht näher bezeichnet"
"M48.26","Baastrup-Syndrom: Lumbalbereich"
"E89.6","Nebennierenrinden- (Nebennierenmark-) Unterfunktion nach medizinischen Maßnahmen"
"C44.9","Bösartige Neubildung der Haut, nicht näher bezeichnet"
"E01.1","Jodmangelbedingte mehrknotige Struma (endemisch)"
"M31.6","Sonstige Riesenzellarteriitis"
"---","Rest (2.002 Zeilen)"
"L99.13","Stadium 3 der akuten Haut-Graft-versus-Host-Krankheit"
"I05.1","Rheumatische Mitralklappeninsuffizienz"
"Z50.0","Rehabilitationsmaßnahmen bei Herzkrankheit"
"L89.37","Dekubitus 4. Grades: Ferse"
"D47.4","Osteomyelofibrose"
"K90.2","Syndrom der blinden Schlinge, anderenorts nicht klassifiziert"
"---","Rest (2.005 Zeilen)"
"M99.91","Biomechanische Funktionsstörung, nicht näher bezeichnet: Zervikalbereich [zervikothorakal]"
"M99.97","Biomechanische Funktionsstörung, nicht näher bezeichnet: Obere Extremität [akromioklavikular, sternoklavikular]"
"M99.98","Biomechanische Funktionsstörung, nicht näher bezeichnet: Brustkorb [kostochondral, kostovertebral, sternochondral]"
"C04.1","Bösartige Neubildung: Seitlicher Teil des Mundbodens"
"---","Rest (2.018 Zeilen)"
"K55.21","Angiodysplasie des Kolons: Ohne Angabe einer Blutung"
"M24.61","Ankylose eines Gelenkes: Schulterregion [Klavikula, Skapula, Akromioklavikular-, Schulter-, Sternoklavikulargelenk]"
"C75.9","Bösartige Neubildung: Endokrine Drüse, nicht näher bezeichnet"
"E79.8","Sonstige Störungen des Purin- und Pyrimidinstoffwechsels"
"J04.1","Akute Tracheitis"
"M19.02","Primäre Arthrose sonstiger Gelenke: Oberarm [Humerus, Ellenbogengelenk]"
"---","Rest (2.026 Zeilen)"
"M19.25","Sonstige sekundäre Arthrose: Beckenregion und Oberschenkel [Becken, Femur, Gesäß, Hüfte, Hüftgelenk, Iliosakralgelenk]"
"M72.85","Sonstige Fibromatosen: Beckenregion und Oberschenkel [Becken, Femur, Gesäß, Hüfte, Hüftgelenk, Iliosakralgelenk]"
"L89.13","Dekubitus 2. Grades: Beckenkamm"
"M24.45","Habituelle Luxation und Subluxation eines Gelenkes: Beckenregion und Oberschenkel [Becken, Femur, Gesäß, Hüfte, Hüftgelenk, Iliosakralgelenk]"
"M49.59","Wirbelkörperkompression bei anderenorts klassifizierten Krankheiten: Nicht näher bezeichnete Lokalisation"
"M82.89","Osteoporose bei sonstigen anderenorts klassifizierten Krankheiten: Nicht näher bezeichnete Lokalisation"
"B02.7","Zoster generalisatus"
"---","Rest (1.977 Zeilen)"
"D46.9","Myelodysplastisches Syndrom, nicht näher bezeichnet"
"E13.20","Sonstiger näher bezeichneter Diabetes mellitus: Mit Nierenkomplikationen: Nicht als entgleist bezeichnet"
"G51.8","Sonstige Krankheiten des N. facialis"
"M43.26","Sonstige Wirbelfusion: Lumbalbereich"
"---","Rest (2.869 Zeilen)"
"K26.5","Ulcus duodeni: Chronisch oder nicht näher bezeichnet, mit Perforation"
"D46.7","Sonstige myelodysplastische Syndrome"
"T46.5","Vergiftung: Sonstige Antihypertensiva, anderenorts nicht klassifiziert"
"H58.22","Stadium 2 der chronischen Augen-Graft-versus-Host-Krankheit"
"I25.6","Stumme Myokardischämie"
"I64","Schlaganfall, nicht als Blutung oder Infarkt bezeichnet"
"M87.86","Sonstige Knochennekrose: Unterschenkel [Fibula, Tibia, Kniegelenk]"
"Z97.1","Vorhandensein einer künstlichen Extremität (komplett) (partiell)"
"L89.36","Dekubitus 4. Grades: Trochanter"
"C05.0","Bösartige Neubildung: Harter Gaumen"
"L65.8","Sonstiger näher bezeichneter Haarausfall ohne Narbenbildung"
"M79.20","Neuralgie und Neuritis, nicht näher bezeichnet: Mehrere Lokalisationen"
"---","Rest (1.974 Zeilen)"
"I74.1","Embolie und Thrombose sonstiger und nicht näher bezeichneter Abschnitte der Aorta"
"U81.22","Klebsiella oxytoca mit Multiresistenz 3MRGN"
"F06.0","Organische Halluzinose"
"J68.4","Chronische Krankheiten der Atmungsorgane durch chemische Substanzen, Gase, Rauch und Dämpfe"
"---","Rest (2.803 Zeilen)"
"C05.1","Bösartige Neubildung: Weicher Gaumen"
"---","Rest (1.970 Zeilen)"
"F10.7","Psychische und Verhaltensstörungen durch Alkohol: Restzustand und verzögert auftretende psychotische Störung"
"G52.2","Krankheiten des N. vagus [X. Hirnnerv]"
"M40.56","Lordose, nicht näher bezeichnet: Lumbalbereich"
"M47.25","Sonstige Spondylose mit Radikulopathie: Thorakolumbalbereich"
"U81.44","Enterobacter-cloacae-Komplex mit Multiresistenz 4MRGN"
"---","Rest (2.870 Zeilen)"
"K57.02","Divertikulitis des Dünndarmes mit Perforation und Abszess, ohne Angabe einer Blutung"
"N05.2","Nicht näher bezeichnetes nephritisches Syndrom: Diffuse membranöse Glomerulonephritis"
"G97.9","Krankheit des Nervensystems nach medizinischer Maßnahme, nicht näher bezeichnet"
"I08.2","Krankheiten der Aorten- und Trikuspidalklappe, kombiniert"
"Z80.7","Andere bösartige Neubildungen des lymphatischen, blutbildenden oder verwandten Gewebes in der Familienanamnese"
"C06.0","Bösartige Neubildung: Wangenschleimhaut"
"N15.11","Perinephritischer Abszess"
"T84.00","Mechanische Komplikation durch eine Gelenkendoprothese: Schultergelenk"
"D41.2","Neubildung unsicheren oder unbekannten Verhaltens: Ureter"
"S15.03","Verletzung: A. carotis interna"
"C84.8","Kutanes T-Zell-Lymphom, nicht näher bezeichnet"
"E56.9","Vitaminmangel, nicht näher bezeichnet"
"C51.1","Bösartige Neubildung der Vulva: Labium minus"
"I60.7","Subarachnoidalblutung, von nicht näher bezeichneter intrakranieller Arterie ausgehend"
"R45.3","Demoralisierung und Apathie"
"M19.28","Sonstige sekundäre Arthrose: Sonstige [Hals, Kopf, Rippen, Rumpf, Schädel, Wirbelsäule]"
"---","Rest (1.982 Zeilen)"
"H25.9","Senile Katarakt, nicht näher bezeichnet"
"E66.10","Arzneimittelinduzierte Adipositas: Adipositas Grad I (WHO) bei Patienten von 18 Jahren und älter"
"H15.0","Skleritis"
"H59.9","Affektion des Auges und der Augenanhangsgebilde nach medizinischen Maßnahmen, nicht näher bezeichnet"
"Z12.3","Spezielle Verfahren zur Untersuchung auf Neubildung der Mamma [Brustdrüse]"
"---","Rest (1.991 Zeilen)"
"M90.70","Knochenfraktur bei Neubildungen: Mehrere Lokalisationen"
"T24.60","Verätzung Grad 2a der Hüfte und des Beines, ausgenommen Knöchelregion und Fuß"
"C22.7","Sonstige näher bezeichnete Karzinome der Leber"
"M82.10","Osteoporose bei endokrinen Störungen: Mehrere Lokalisationen"
"---","Rest (2.824 Zeilen)"
"C68.9","Bösartige Neubildung: Harnorgan, nicht näher bezeichnet"
"K31.82","Angiodysplasie des Magens und des Duodenums mit Blutung"
"I43.1","Kardiomyopathie bei Stoffwechselkrankheiten"
"M46.42","Diszitis, nicht näher bezeichnet: Zervikalbereich"
"D47.0","Histiozyten- und Mastzelltumor unsicheren oder unbekannten Verhaltens"
"M43.19","Spondylolisthesis: Nicht näher bezeichnete Lokalisation"
"---","Rest (2.887 Zeilen)"
"M65.17","Sonstige infektiöse (Teno-)Synovitis: Knöchel und Fuß [Fußwurzel, Mittelfuß, Zehen, Sprunggelenk, sonstige Gelenke des Fußes]"
"H18.9","Affektion der Hornhaut, nicht näher bezeichnet"
"M85.87","Sonstige näher bezeichnete Veränderungen der Knochendichte und -struktur: Knöchel und Fuß [Fußwurzel, Mittelfuß, Zehen, Sprunggelenk, sonstige Gelenke des Fußes]"
"Z09.2","Nachuntersuchung nach Chemotherapie wegen anderer Krankheitszustände"
"E50.7","Sonstige Manifestationen des Vitamin-A-Mangels am Auge"
"S71.87","Weichteilschaden I. Grades bei offener Fraktur oder Luxation der Hüfte und des Oberschenkels"
"C68.0","Bösartige Neubildung: Urethra"
"D65.9","Defibrinationssyndrom, nicht näher bezeichnet"
"H30.9","Chorioretinitis, nicht näher bezeichnet"
"K22.9","Krankheit des Ösophagus, nicht näher bezeichnet"
"L89.08","Dekubitus 1. Grades: Sonstige Lokalisationen der unteren Extremität"
"S53.48","Verstauchung und Zerrung des Ellenbogens: Sonstige Teile"
"M65.04","Sehnenscheidenabszess: Hand [Finger, Handwurzel, Mittelhand, Gelenke zwischen diesen Knochen]"
"H83.2","Funktionsstörung des Labyrinths"
"C43.2","Bösartiges Melanom des Ohres und des äußeren Gehörganges"
"M80.98","Nicht näher bezeichnete Osteoporose mit pathologischer Fraktur: Sonstige [Hals, Kopf, Rippen, Rumpf, Schädel, Wirbelsäule]"
"M24.65","Ankylose eines Gelenkes: Beckenregion und Oberschenkel [Becken, Femur, Gesäß, Hüfte, Hüftgelenk, Iliosakralgelenk]"
"---","Rest (2.758 Zeilen)"
"---","Rest (1.791 Zeilen)"
"H51.0","Konjugierte Blicklähmung"
"M89.89","Sonstige näher bezeichnete Knochenkrankheiten: Nicht näher bezeichnete Lokalisation"
"---","Rest (2.726 Zeilen)"
"C04.9","Bösartige Neubildung: Mundboden, nicht näher bezeichnet"
"C48.8","Bösartige Neubildung: Retroperitoneum und Peritoneum, mehrere Teilbereiche überlappend"
"---","Rest (2.784 Zeilen)"
"---","Rest (1.688 Zeilen)"
"---","Rest (2.664 Zeilen)"
"---","Rest (1.625 Zeilen)"
"---","Rest (2.623 Zeilen)"
"I71.00","Dissektion der Aorta nicht näher bezeichneter Lokalisation, ohne Angabe einer Ruptur"
"---","Rest (1.695 Zeilen)"
"C69.6","Bösartige Neubildung: Orbita"
"Z99.9","Langzeitige Abhängigkeit von einem nicht näher bezeichneten unterstützenden Apparat, medizinischen Gerät oder Hilfsmittel"
"C31.0","Bösartige Neubildung: Sinus maxillaris [Kieferhöhle]"
"J12.3","Pneumonie durch humanes Metapneumovirus"
"---","Rest (2.064 Zeilen)"
"F62.0","Andauernde Persönlichkeitsänderung nach Extrembelastung"
"M53.96","Krankheit der Wirbelsäule und des Rückens, nicht näher bezeichnet: Lumbalbereich"
"R82.1","Myoglobinurie"
"---","Rest (2.007 Zeilen)"
"M02.91","Reaktive Arthritis, nicht näher bezeichnet: Schulterregion [Klavikula, Skapula, Akromioklavikular-, Schulter-, Sternoklavikulargelenk]"
"U50.41","Schwere motorische Funktionseinschränkung: Motorischer FIM: 31-42 Punkte"
"F60.5","Anankastische [zwanghafte] Persönlichkeitsstörung"
"J21.8","Akute Bronchiolitis durch sonstige näher bezeichnete Erreger"
"L29.0","Pruritus ani"
"T08.0","Fraktur der Wirbelsäule, Höhe nicht näher bezeichnet: geschlossen oder o.n.A."
"---","Rest (2.012 Zeilen)"
"M40.04","Kyphose als Haltungsstörung: Thorakalbereich"
"D22.2","Melanozytennävus des Ohres und des äußeren Gehörganges"
"D23.9","Sonstige gutartige Neubildungen: Haut, nicht näher bezeichnet"
"E10.50","Diabetes mellitus, Typ 1: Mit peripheren vaskulären Komplikationen: Nicht als entgleist bezeichnet"
"F06.4","Organische Angststörung"
"I89.05","Lymphödem, sonstige Lokalisation, Stadium III"
"---","Rest (2.805 Zeilen)"
"D13.7","Gutartige Neubildung: Endokriner Drüsenanteil des Pankreas"
"---","Rest (1.998 Zeilen)"
"G54.4","Läsionen der Lumbosakralwurzeln, anderenorts nicht klassifiziert"
"T85.59","Mechanische Komplikation durch gastrointestinale Prothesen, Implantate oder Transplantate, Lokalisation nicht näher bezeichnet"
"F55.5","Schädlicher Gebrauch von nichtabhängigkeitserzeugenden Substanzen: Steroide und Hormone"
"K73.2","Chronische aktive Hepatitis, anderenorts nicht klassifiziert"
"---","Rest (2.859 Zeilen)"
"---","Rest (1.978 Zeilen)"
"M15.3","Sekundäre multiple Arthrose"
"H36.8","Sonstige Affektionen der Netzhaut bei anderenorts klassifizierten Krankheiten"
"---","Rest (2.762 Zeilen)"
"J39.88","Sonstige näher bezeichnete Krankheiten der oberen Atemwege"
"J60","Kohlenbergarbeiter-Pneumokoniose"
"M05.86","Sonstige seropositive chronische Polyarthritis: Unterschenkel [Fibula, Tibia, Kniegelenk]"
"---","Rest (1.988 Zeilen)"
"T86.59","Sonstiges und nicht näher bezeichnetes Versagen und Abstoßung eines Hauttransplantates"
"G90.71","Komplexes regionales Schmerzsyndrom der unteren Extremität, sonstiger und nicht näher bezeichneter Typ"
"I31.1","Chronische konstriktive Perikarditis"
"M24.84","Sonstige näher bezeichnete Gelenkschädigungen, anderenorts nicht klassifiziert: Hand [Finger, Handwurzel, Mittelhand, Gelenke zwischen diesen Knochen]"
"R49.8","Sonstige und nicht näher bezeichnete Störungen der Stimme"
"---","Rest (2.038 Zeilen)"
"M53.92","Krankheit der Wirbelsäule und des Rückens, nicht näher bezeichnet: Zervikalbereich"
"Z12.4","Spezielle Verfahren zur Untersuchung auf Neubildung der Cervix uteri"
"C44.8","Sonstige bösartige Neubildungen: Haut, mehrere Teilbereiche überlappend"
"M46.02","Spinale Enthesopathie: Zervikalbereich"
"M80.48","Arzneimittelinduzierte Osteoporose mit pathologischer Fraktur: Sonstige [Hals, Kopf, Rippen, Rumpf, Schädel, Wirbelsäule]"
"M85.88","Sonstige näher bezeichnete Veränderungen der Knochendichte und -struktur: Sonstige [Hals, Kopf, Rippen, Rumpf, Schädel, Wirbelsäule]"
"T17.4","Fremdkörper in der Trachea"
"---","Rest (2.890 Zeilen)"
"C75.5","Bösartige Neubildung: Glomus aorticum und sonstige Paraganglien"
"---","Rest (2.042 Zeilen)"
"L89.00","Dekubitus 1. Grades: Kopf"
"E66.11","Arzneimittelinduzierte Adipositas: Adipositas Grad II (WHO) bei Patienten von 18 Jahren und älter"
"I71.02","Dissektion der Aorta abdominalis, ohne Angabe einer Ruptur"
"M46.49","Diszitis, nicht näher bezeichnet: Nicht näher bezeichnete Lokalisation"
"M86.45","Chronische Osteomyelitis mit Fistel: Beckenregion und Oberschenkel [Becken, Femur, Gesäß, Hüfte, Hüftgelenk, Iliosakralgelenk]"
"---","Rest (2.851 Zeilen)"
"C15.1","Bösartige Neubildung: Thorakaler Ösophagus"
"N11.1","Chronische obstruktive Pyelonephritis"
"E63.9","Alimentärer Mangelzustand, nicht näher bezeichnet"
"M90.89","Osteopathie bei sonstigen anderenorts klassifizierten Krankheiten: Nicht näher bezeichnete Lokalisation"
"---","Rest (1.628 Zeilen)"
"---","Rest (1.234 Zeilen)"
"---","Rest (1.976 Zeilen)"
"D03.3","Melanoma in situ sonstiger und nicht näher bezeichneter Teile des Gesichtes"
"---","Rest (1.994 Zeilen)"
"I24.8","Sonstige Formen der akuten ischämischen Herzkrankheit"
"N85.9","Nichtentzündliche Krankheit des Uterus, nicht näher bezeichnet"
"E06.0","Akute Thyreoiditis"
"---","Rest (2.063 Zeilen)"
"C78.3","Sekundäre bösartige Neubildung sonstiger und nicht näher bezeichneter Atmungsorgane"
"H15.1","Episkleritis"
"M01.29","Arthritis bei Lyme-Krankheit: Nicht näher bezeichnete Lokalisation"
"I44.3","Sonstiger und nicht näher bezeichneter atrioventrikulärer Block"
"---","Rest (2.029 Zeilen)"
"M70.3","Sonstige Bursitis im Bereich des Ellenbogens"
"Q50.3","Sonstige angeborene Fehlbildungen des Ovars"
"U51.22","Schwere kognitive Funktionseinschränkung: MMSE: 0-16 Punkte"
"A40.1","Sepsis durch Streptokokken, Gruppe B"
"D48.3","Neubildung unsicheren oder unbekannten Verhaltens: Retroperitoneum"
"F60.1","Schizoide Persönlichkeitsstörung"
"F01.8","Sonstige vaskuläre Demenz"
"I97.0","Postkardiotomie-Syndrom"
"M62.48","Muskelkontraktur: Sonstige [Hals, Kopf, Rippen, Rumpf, Schädel, Wirbelsäule]"
"M67.80","Sonstige näher bezeichnete Krankheiten der Synovialis und der Sehnen: Mehrere Lokalisationen"
"M89.81","Sonstige näher bezeichnete Knochenkrankheiten: Schulterregion [Klavikula, Skapula, Akromioklavikular-, Schulter-, Sternoklavikulargelenk]"
"Z40.9","Prophylaktische Operation, nicht näher bezeichnet"
"M54.95","Rückenschmerzen, nicht näher bezeichnet: Thorakolumbalbereich"
"M86.26","Subakute Osteomyelitis: Unterschenkel [Fibula, Tibia, Kniegelenk]"
"---","Rest (2.083 Zeilen)"
"M31.8","Sonstige näher bezeichnete nekrotisierende Vaskulopathien"
"M99.88","Sonstige biomechanische Funktionsstörungen: Brustkorb [kostochondral, kostovertebral, sternochondral]"
"Z89.3","(Teilweiser) Verlust der oberen Extremität, beidseitig"
"---","Rest (2.836 Zeilen)"
"---","Rest (2.003 Zeilen)"
"---","Rest (2.894 Zeilen)"
"M94.81","Sonstige näher bezeichnete Knorpelkrankheiten: Schulterregion [Klavikula, Skapula, Akromioklavikular-, Schulter-, Sternoklavikulargelenk]"
"Q64.3","Sonstige Atresie und (angeborene) Stenose der Urethra und des Harnblasenhalses"
"I36.8","Sonstige nichtrheumatische Trikuspidalklappenkrankheiten"
"J43.0","McLeod-Syndrom"
"K82.3","Gallenblasenfistel"
"Q05.1","Thorakale Spina bifida mit Hydrozephalus"
"---","Rest (2.835 Zeilen)"
"---","Rest (2.040 Zeilen)"
"M75.9","Schulterläsion, nicht näher bezeichnet"
"D01.3","Carcinoma in situ: Analkanal und Anus"
"D23.6","Sonstige gutartige Neubildungen: Haut der oberen Extremität, einschließlich Schulter"
"N90.1","Mittelgradige Dysplasie der Vulva"
"---","Rest (1.984 Zeilen)"
"M25.35","Sonstige Instabilität eines Gelenkes: Beckenregion und Oberschenkel [Becken, Femur, Gesäß, Hüfte, Hüftgelenk, Iliosakralgelenk]"
"C91.40","Haarzellenleukämie: Ohne Angabe einer kompletten Remission"
"M42.19","Osteochondrose der Wirbelsäule beim Erwachsenen: Nicht näher bezeichnete Lokalisation"
"E85.3","Sekundäre systemische Amyloidose"
"G21.1","Sonstiges arzneimittelinduziertes Parkinson-Syndrom"
"---","Rest (2.820 Zeilen)"
"M48.03","Spinal(kanal)stenose: Zervikothorakalbereich"
"---","Rest (2.019 Zeilen)"
"E07.0","Hypersekretion von Kalzitonin"
"F01.9","Vaskuläre Demenz, nicht näher bezeichnet"
"F05.1","Delir bei Demenz"
"K63.4","Enteroptose"
"---","Rest (2.006 Zeilen)"
"R49.1","Aphonie"
"M99.93","Biomechanische Funktionsstörung, nicht näher bezeichnet: Lumbalbereich [lumbosakral]"
"N95.8","Sonstige näher bezeichnete klimakterische Störungen"
"---","Rest (2.025 Zeilen)"
"A04.3","Darminfektion durch enterohämorrhagische Escherichia coli"
"M84.45","Pathologische Fraktur, anderenorts nicht klassifiziert: Beckenregion und Oberschenkel [Becken, Femur, Gesäß, Hüfte, Hüftgelenk, Iliosakralgelenk]"
"L89.09","Dekubitus 1. Grades: Sonstige und nicht näher bezeichnete Lokalisationen"
"I05.2","Mitralklappenstenose mit Insuffizienz"
"K04.4","Akute apikale Parodontitis pulpalen Ursprungs"
"---","Rest (2.043 Zeilen)"
"G12.9","Spinale Muskelatrophie, nicht näher bezeichnet"
"M13.87","Sonstige näher bezeichnete Arthritis: Knöchel und Fuß [Fußwurzel, Mittelfuß, Zehen, Sprunggelenk, sonstige Gelenke des Fußes]"
"M72.96","Fibromatose, nicht näher bezeichnet: Unterschenkel [Fibula, Tibia, Kniegelenk]"
"N16.1","Tubulointerstitielle Nierenkrankheiten bei Neubildungen"
"---","Rest (2.852 Zeilen)"
"D44.7","Neubildung unsicheren oder unbekannten Verhaltens: Glomus aorticum und sonstige Paraganglien"
"N76.80","Fournier-Gangrän bei der Frau"
"D58.9","Hereditäre hämolytische Anämie, nicht näher bezeichnet"
"Z43.80","Versorgung eines Thorakostomas"
"---","Rest (2.013 Zeilen)"
"G23.8","Sonstige näher bezeichnete degenerative Krankheiten der Basalganglien"
"M46.24","Wirbelosteomyelitis: Thorakalbereich"
"Z76.0","Ausstellung wiederholter Verordnung"
"---","Rest (1.980 Zeilen)"
"B87.1","Wundmyiasis"
"D73.3","Abszess der Milz"
"F13.8","Psychische und Verhaltensstörungen durch Sedativa oder Hypnotika: Sonstige psychische und Verhaltensstörungen"
"N30.4","Strahlenzystitis"
"S37.9","Verletzung eines nicht näher bezeichneten Harnorgans oder Beckenorgans"
"---","Rest (2.968 Zeilen)"
"---","Rest (2.031 Zeilen)"
"M79.90","Krankheit des Weichteilgewebes, nicht näher bezeichnet: Mehrere Lokalisationen"
"---","Rest (2.866 Zeilen)"
"D21.4","Sonstige gutartige Neubildungen: Bindegewebe und andere Weichteilgewebe des Abdomens"
"---","Rest (2.076 Zeilen)"
"H69.0","Erweiterte Tuba auditiva"
"M54.88","Sonstige Rückenschmerzen: Sakral- und Sakrokokzygealbereich"
"M99.41","Bindegewebige Stenose des Spinalkanals: Zervikalbereich [zervikothorakal]"
"Q22.5","Ebstein-Anomalie"
"---","Rest (2.878 Zeilen)"
"C95.00","Akute Leukämie nicht näher bezeichneten Zelltyps: Ohne Angabe einer kompletten Remission"
"---","Rest (2.108 Zeilen)"
"M06.88","Sonstige näher bezeichnete chronische Polyarthritis: Sonstige [Hals, Kopf, Rippen, Rumpf, Schädel, Wirbelsäule]"
"M41.92","Skoliose, nicht näher bezeichnet: Zervikalbereich"
"D52.1","Arzneimittelinduzierte Folsäure-Mangelanämie"
"D82.4","Hyperimmunglobulin-E[IgE]-Syndrom"
"H58.21","Stadium 1 der chronischen Augen-Graft-versus-Host-Krankheit"
"---","Rest (2.868 Zeilen)"
"G11.9","Hereditäre Ataxie, nicht näher bezeichnet"
"L89.06","Dekubitus 1. Grades: Trochanter"
"M42.94","Osteochondrose der Wirbelsäule, nicht näher bezeichnet: Thorakalbereich"
"Z50.2","Rehabilitationsmaßnahmen bei Alkoholismus"
"---","Rest (2.871 Zeilen)"
"Z01.2","Untersuchung der Zähne"
"S05.9","Verletzung des Auges und der Orbita, nicht näher bezeichnet"
"I65.8","Verschluss und Stenose sonstiger präzerebraler Arterien"
"---","Rest (2.895 Zeilen)"
"---","Rest (2.134 Zeilen)"
"L72.8","Sonstige follikuläre Zysten der Haut und der Unterhaut"
"M81.09","Postmenopausale Osteoporose: Nicht näher bezeichnete Lokalisation"
"J85.0","Gangrän und Nekrose der Lunge"
"K63.9","Darmkrankheit, nicht näher bezeichnet"
"M65.11","Sonstige infektiöse (Teno-)Synovitis: Schulterregion [Klavikula, Skapula, Akromioklavikular-, Schulter-, Sternoklavikulargelenk]"
"T83.9","Nicht näher bezeichnete Komplikation durch Prothese, Implantat oder Transplantat im Urogenitaltrakt"
"---","Rest (2.880 Zeilen)"
"M65.29","Tendinitis calcarea: Nicht näher bezeichnete Lokalisation"
"---","Rest (2.052 Zeilen)"
"D10.7","Gutartige Neubildung: Hypopharynx"
