"T79.2","Traumatisch bedingte sekundäre oder rezidivierende Blutung"
"T79.68","Traumatische Muskelischämie sonstiger Lokalisation"
"---","Rest (2.810 Zeilen)"
"M30.1","Panarteriitis mit Lungenbeteiligung"
"---","Rest (1.942 Zeilen)"
"F81.8","Sonstige Entwicklungsstörungen schulischer Fertigkeiten"
"M23.20","Meniskusschädigung durch alten Riss oder alte Verletzung: Mehrere Lokalisationen"
"D35.4","Gutartige Neubildung: Epiphyse [Glandula pinealis] [Zirbeldrüse]"
"D69.80","Hämorrhagische Diathese durch Thrombozytenaggregationshemmer"
"E88.3","Tumorlyse-Syndrom"
"G72.9","Myopathie, nicht näher bezeichnet"
"I60.8","Sonstige Subarachnoidalblutung"
"I66.0","Verschluss und Stenose der A. cerebri media"
"I80.9","Thrombose, Phlebitis und Thrombophlebitis nicht näher bezeichneter Lokalisation"
"K03.6","Auflagerungen [Beläge] auf den Zähnen"
"M13.0","Polyarthritis, nicht näher bezeichnet"
"M65.80","Sonstige Synovitis und Tenosynovitis: Mehrere Lokalisationen"
"N81.6","Rektozele"
"N88.3","Zervixinsuffizienz"
"Q24.5","Fehlbildung der Koronargefäße"
"Q74.3","Arthrogryposis multiplex congenita"
"R93.3","Abnorme Befunde bei der bildgebenden Diagnostik sonstiger Teile des Verdauungstraktes"
"S04.3","Verletzung des N. trigeminus"
"S63.01","Luxation des Handgelenkes: Radioulnar (-Gelenk)"
"Z08.0","Nachuntersuchung nach chirurgischem Eingriff wegen bösartiger Neubildung"
"Z36.8","Sonstiges pränatales Screening"
"---","Rest (2.755 Zeilen)"
"T62.0","Toxische Wirkung: Verzehrte Pilze"
"T86.83","Versagen und Abstoßung: Hornhauttransplantat des Auges"
"---","Rest (1.922 Zeilen)"
"M99.04","Segmentale und somatische Funktionsstörungen: Sakralbereich [sakrokokzygeal, sakroiliakal]"
"H43.3","Sonstige Glaskörpertrübungen"
"E11.73","Diabetes mellitus, Typ 2: Mit multiplen Komplikationen: Mit sonstigen multiplen Komplikationen, als entgleist bezeichnet"
"O62.9","Abnorme Wehentätigkeit, nicht näher bezeichnet"
"D05.1","Carcinoma in situ der Milchgänge"
"I87.21","Venöse Insuffizienz (chronisch) (peripher) mit Ulzeration"
"R84.9","Abnorme Befunde in Untersuchungsmaterialien aus Atemwegen und Thorax: Nicht näher bezeichneter abnormer Befund"
"D31.6","Gutartige Neubildung: Orbita, nicht näher bezeichnet"
"E78.6","Lipoproteinmangel"
"S36.14","Mittelschwere Rissverletzung der Leber"
"T91.2","Folgen einer sonstigen Fraktur des Thorax und des Beckens"
"T92.8","Folgen sonstiger näher bezeichneter Verletzungen der oberen Extremität"
"Z99.4","Langzeitige Abhängigkeit vom Kunstherz"
"H26.0","Infantile, juvenile und präsenile Katarakt"
"M30.0","Panarteriitis nodosa"
"---","Rest (1.825 Zeilen)"
"F17.3","Psychische und Verhaltensstörungen durch Tabak: Entzugssyndrom"
"H40.4","Glaukom (sekundär) nach Entzündung des Auges"
"Q51.4","Uterus unicornis"
"H20.8","Sonstige Iridozyklitis"
"I25.0","Atherosklerotische Herz-Kreislauf-Krankheit, so beschrieben"
"M41.96","Skoliose, nicht näher bezeichnet: Lumbalbereich"
"Q61.3","Polyzystische Niere, nicht näher bezeichnet"
"S00.24","Sonstige oberflächliche Verletzungen des Augenlides und der Periokularregion: Oberflächlicher Fremdkörper (Splitter)"
"S27.88","Verletzung: Sonstige näher bezeichnete intrathorakale Organe und Strukturen"
"S41.88","Weichteilschaden II. Grades bei offener Fraktur oder Luxation des Oberarmes"
"C85.1","B-Zell-Lymphom, nicht näher bezeichnet"
"M84.12","Nichtvereinigung der Frakturenden [Pseudarthrose]: Oberarm [Humerus, Ellenbogengelenk]"
"J44.19","Chronische obstruktive Lungenkrankheit mit akuter Exazerbation, nicht näher bezeichnet: FEV1 nicht näher bezeichnet"
"S43.03","Luxation des Humerus nach unten"
"---","Rest (1.943 Zeilen)"
"M79.53","Verbliebener Fremdkörper im Weichteilgewebe: Unterarm [Radius, Ulna, Handgelenk]"
"F69","Nicht näher bezeichnete Persönlichkeits- und Verhaltensstörung"
"G35.30","Multiple Sklerose mit sekundär-chronischem Verlauf: Ohne Angabe einer akuten Exazerbation oder Progression"
"L28.2","Sonstige Prurigo"
"S46.3","Verletzung des Muskels und der Sehne des M. triceps brachii"
"U81.27","Proteus mirabilis mit Multiresistenz 3MRGN"
"---","Rest (2.792 Zeilen)"
"M62.85","Sonstige näher bezeichnete Muskelkrankheiten: Beckenregion und Oberschenkel [Becken, Femur, Gesäß, Hüfte, Hüftgelenk, Iliosakralgelenk]"
"G57.5","Tarsaltunnel-Syndrom"
"S36.15","Schwere Rissverletzung der Leber"
"---","Rest (1.882 Zeilen)"
"N28.0","Ischämie und Infarkt der Niere"
"E13.60","Sonstiger näher bezeichneter Diabetes mellitus: Mit sonstigen näher bezeichneten Komplikationen: Nicht als entgleist bezeichnet"
"T29.20","Verbrennungen mehrerer Körperregionen, wobei höchstens Verbrennungen des Grades 2a angegeben sind"
"C78.8","Sekundäre bösartige Neubildung sonstiger und nicht näher bezeichneter Verdauungsorgane"
"D16.8","Gutartige Neubildung des Knochens und des Gelenkknorpels: Knöchernes Becken"
"E07.8","Sonstige näher bezeichnete Krankheiten der Schilddrüse"
"F51.5","Albträume [Angstträume]"
"M25.71","Osteophyt: Schulterregion [Klavikula, Skapula, Akromioklavikular-, Schulter-, Sternoklavikulargelenk]"
"M85.86","Sonstige näher bezeichnete Veränderungen der Knochendichte und -struktur: Unterschenkel [Fibula, Tibia, Kniegelenk]"
"Q66.7","Pes cavus"
"S37.22","Ruptur der Harnblase"
"S62.14","Fraktur: Os trapezium"
"K10.20","Maxillärer Abszess ohne Angabe einer Ausbreitung nach retromaxillär oder in die Fossa canina"
"K40.00","Doppelseitige Hernia inguinalis mit Einklemmung, ohne Gangrän: Nicht als Rezidivhernie bezeichnet"
"---","Rest (1.824 Zeilen)"
"G46.0","Arteria-cerebri-media-Syndrom"
"S12.21","Fraktur des 3. Halswirbels"
"R85.5","Abnorme Befunde in Untersuchungsmaterialien aus Verdauungsorganen und Bauchhöhle: Abnorme mikrobiologische Befunde"
"E53.9","Vitamin-B-Mangel, nicht näher bezeichnet"
"N88.8","Sonstige näher bezeichnete nichtentzündliche Krankheiten der Cervix uteri"
"---","Rest (2.685 Zeilen)"
"S42.22","Fraktur des proximalen Endes des Humerus: Collum chirurgicum"
"D22.4","Melanozytennävus der behaarten Kopfhaut und des Halses"
"M23.82","Sonstige Binnenschädigungen des Kniegelenkes: Hinteres Kreuzband"
"M24.23","Krankheiten der Bänder: Unterarm [Radius, Ulna, Handgelenk]"
"---","Rest (1.937 Zeilen)"
"Q78.8","Sonstige näher bezeichnete Osteochondrodysplasien"
"T44.7","Vergiftung: Beta-Rezeptorenblocker, anderenorts nicht klassifiziert"
"I67.80","Vasospasmen bei Subarachnoidalblutung"
"B36.9","Oberflächliche Mykose, nicht näher bezeichnet"
"H26.4","Cataracta secundaria"
"I15.90","Sekundäre Hypertonie, nicht näher bezeichnet: Ohne Angabe einer hypertensiven Krise"
"K22.4","Dyskinesie des Ösophagus"
"---","Rest (2.776 Zeilen)"
"A97.0","Dengue ohne Warnzeichen"
"O00.2","Ovarialgravidität"
"O06.8","Nicht näher bezeichneter Abort: Komplett oder nicht näher bezeichnet, mit sonstigen und nicht näher bezeichneten Komplikationen"
"M87.95","Knochennekrose, nicht näher bezeichnet: Beckenregion und Oberschenkel [Becken, Femur, Gesäß, Hüfte, Hüftgelenk, Iliosakralgelenk]"
"---","Rest (1.880 Zeilen)"
"S69.9","Nicht näher bezeichnete Verletzung des Handgelenkes und der Hand"
"D61.2","Aplastische Anämie infolge sonstiger äußerer Ursachen"
"F31.3","Bipolare affektive Störung, gegenwärtig leichte oder mittelgradige depressive Episode"
"R09.0","Asphyxie"
"S09.1","Verletzung von Muskeln und Sehnen des Kopfes"
"T55","Toxische Wirkung von Seifen und Detergenzien"
"T84.3","Mechanische Komplikation durch sonstige Knochengeräte, -implantate oder -transplantate"
"T84.7","Infektion und entzündliche Reaktion durch sonstige orthopädische Endoprothesen, Implantate oder Transplantate"
"---","Rest (2.821 Zeilen)"
"G41.9","Status epilepticus, nicht näher bezeichnet"
"---","Rest (1.864 Zeilen)"
"E74.3","Sonstige Störungen der intestinalen Kohlenhydratabsorption"
"M24.31","Pathologische Luxation und Subluxation eines Gelenkes, anderenorts nicht klassifiziert: Schulterregion [Klavikula, Skapula, Akromioklavikular-, Schulter-, Sternoklavikulargelenk]"
"R09.3","Abnormes Sputum"
"X49.9","Akzidentelle Vergiftung"
"S93.12","Luxation einer oder mehrerer Zehen: Interphalangeal (-Gelenk)"
"E78.9","Störung des Lipoproteinstoffwechsels, nicht näher bezeichnet"
"M24.24","Krankheiten der Bänder: Hand [Finger, Handwurzel, Mittelhand, Gelenke zwischen diesen Knochen]"
"M79.00","Rheumatismus, nicht näher bezeichnet: Mehrere Lokalisationen"
"N17.89","Sonstiges akutes Nierenversagen: Stadium nicht näher bezeichnet"
"Q99.9","Chromosomenanomalie, nicht näher bezeichnet"
"T40.3","Vergiftung: Methadon"
"T87.5","Nekrose des Amputationsstumpfes"
"---","Rest (2.680 Zeilen)"
"C92.50","Akute myelomonozytäre Leukämie: Ohne Angabe einer kompletten Remission"
"---","Rest (1.737 Zeilen)"
"I82.9","Embolie und Thrombose nicht näher bezeichneter Vene"
"C79.82","Sekundäre bösartige Neubildung der Genitalorgane"
"C95.8","Leukämie, refraktär auf Standard-Induktionstherapie"
"B48.8","Sonstige näher bezeichnete Mykosen"
"H51.9","Störung der Blickbewegungen, nicht näher bezeichnet"
"J44.80","Sonstige näher bezeichnete chronische obstruktive Lungenkrankheit: FEV1 <35 % des Sollwertes"
"K26.7","Ulcus duodeni: Chronisch, ohne Blutung oder Perforation"
"M79.29","Neuralgie und Neuritis, nicht näher bezeichnet: Nicht näher bezeichnete Lokalisation"
"O24.3","Diabetes mellitus in der Schwangerschaft: Vorher bestehender Diabetes mellitus, nicht näher bezeichnet"
"Q96.9","Turner-Syndrom, nicht näher bezeichnet"
"---","Rest (2.644 Zeilen)"
"D18.10","Lymphangiom: Hygroma colli cysticum"
"M05.90","Seropositive chronische Polyarthritis, nicht näher bezeichnet: Mehrere Lokalisationen"
"M85.44","Solitäre Knochenzyste: Hand [Finger, Handwurzel, Mittelhand, Gelenke zwischen diesen Knochen]"
"Q28.29","Angeborene arteriovenöse Fehlbildung der zerebralen Gefäße, nicht näher bezeichnet"
"M47.96","Spondylose, nicht näher bezeichnet: Lumbalbereich"
"E53.1","Pyridoxinmangel"
"H06.3","Sonstige Affektionen der Orbita bei anderenorts klassifizierten Krankheiten"
"M19.13","Posttraumatische Arthrose sonstiger Gelenke: Unterarm [Radius, Ulna, Handgelenk]"
"M41.20","Sonstige idiopathische Skoliose: Mehrere Lokalisationen der Wirbelsäule"
"N94.9","Nicht näher bezeichneter Zustand im Zusammenhang mit den weiblichen Genitalorganen und dem Menstruationszyklus"
"S69.8","Sonstige näher bezeichnete Verletzungen des Handgelenkes und der Hand"
"S79.8","Sonstige näher bezeichnete Verletzungen der Hüfte und des Oberschenkels"
"U82.1","Multi-Drug Resistant Tuberculosis [MDR-TB]"
"---","Rest (2.769 Zeilen)"
"M72.2","Fibromatose der Plantarfaszie [Ledderhose-Kontraktur]"
"T28.5","Verätzung des Mundes und des Rachens"
"---","Rest (1.877 Zeilen)"
"G96.8","Sonstige näher bezeichnete Krankheiten des Zentralnervensystems"
"M42.09","Juvenile Osteochondrose der Wirbelsäule: Nicht näher bezeichnete Lokalisation"
"T30.4","Verätzung nicht näher bezeichneten Grades, Körperregion nicht näher bezeichnet"
"---","Rest (2.738 Zeilen)"
"E88.22","Lipödem, Stadium III"
"M77.1","Epicondylitis radialis humeri"
"---","Rest (1.828 Zeilen)"
"I50.00","Primäre Rechtsherzinsuffizienz"
"T21.24","Verbrennung Grad 2a des Rumpfes: Rücken [jeder Teil]"
"T94.0","Folgen von Verletzungen mehrerer Körperregionen"
"D13.2","Gutartige Neubildung: Duodenum"
"D22.3","Melanozytennävus sonstiger und nicht näher bezeichneter Teile des Gesichtes"
"K57.10","Divertikulose des Dünndarmes ohne Perforation, Abszess oder Angabe einer Blutung"
"L90.8","Sonstige atrophische Hautkrankheiten"
"M25.64","Gelenksteife, anderenorts nicht klassifiziert: Hand [Finger, Handwurzel, Mittelhand, Gelenke zwischen diesen Knochen]"
"Q90.2","Trisomie 21, Translokation"
"R83.9","Abnorme Liquorbefunde: Nicht näher bezeichneter abnormer Befund"
"---","Rest (2.667 Zeilen)"
"---","Rest (1.885 Zeilen)"
"G31.88","Sonstige näher bezeichnete degenerative Krankheiten des Nervensystems"
"M41.86","Sonstige Formen der Skoliose: Lumbalbereich"
"M54.82","Sonstige Rückenschmerzen: Zervikalbereich"
"M20.6","Erworbene Deformität der Zehe(n), nicht näher bezeichnet"
"M54.97","Rückenschmerzen, nicht näher bezeichnet: Lumbosakralbereich"
"---","Rest (2.732 Zeilen)"
"C84.6","Anaplastisches großzelliges Lymphom, ALK-positiv"
"---","Rest (1.879 Zeilen)"
"B65.9","Schistosomiasis, nicht näher bezeichnet"
"G90.40","Autonome Dysreflexie als hypertone Krisen"
"I72.4","Aneurysma und Dissektion einer Arterie der unteren Extremität"
"---","Rest (2.673 Zeilen)"
"G11.1","Früh beginnende zerebellare Ataxie"
"---","Rest (1.842 Zeilen)"
"H21.8","Sonstige näher bezeichnete Affektionen der Iris und des Ziliarkörpers"
"T98.3","Folgen von Komplikationen bei chirurgischen Eingriffen und medizinischer Behandlung, anderenorts nicht klassifiziert"
"M17.3","Sonstige posttraumatische Gonarthrose"
"E66.21","Übermäßige Adipositas mit alveolärer Hypoventilation: Adipositas Grad II (WHO) bei Patienten von 18 Jahren und älter"
"E72.2","Störungen des Harnstoffzyklus"
"G97.0","Austritt von Liquor cerebrospinalis nach Lumbalpunktion"
"I25.12","Atherosklerotische Herzkrankheit: Zwei-Gefäß-Erkrankung"
"M85.66","Sonstige Knochenzyste: Unterschenkel [Fibula, Tibia, Kniegelenk]"
"N32.9","Krankheit der Harnblase, nicht näher bezeichnet"
"N97.2","Sterilität uterinen Ursprungs bei der Frau"
"Q68.4","Angeborene Verbiegung der Tibia und der Fibula"
"S62.13","Fraktur: Os pisiforme"
"Z43.9","Versorgung einer nicht näher bezeichneten künstlichen Körperöffnung"
"---","Rest (2.641 Zeilen)"
"M85.55","Aneurysmatische Knochenzyste: Beckenregion und Oberschenkel [Becken, Femur, Gesäß, Hüfte, Hüftgelenk, Iliosakralgelenk]"
"---","Rest (1.793 Zeilen)"
"L65.9","Haarausfall ohne Narbenbildung, nicht näher bezeichnet"
"H72.1","Trommelfellperforation am Recessus epitympanicus"
"I50.03","Rechtsherzinsuffizienz mit Beschwerden bei stärkerer Belastung"
"Q25.0","Offener Ductus arteriosus"
"S52.00","Fraktur des proximalen Endes der Ulna: Teil nicht näher bezeichnet"
"Z94.6","Zustand nach Knochentransplantation"
"---","Rest (2.580 Zeilen)"
"---","Rest (1.128 Zeilen)"
"H34.8","Sonstiger Netzhautgefäßverschluss"
"---","Rest (1.457 Zeilen)"
"T15.0","Fremdkörper in der Kornea"
"---","Rest (2.437 Zeilen)"
"A04.4","Sonstige Darminfektionen durch Escherichia coli"
"---","Rest (1.852 Zeilen)"
"M25.86","Sonstige näher bezeichnete Gelenkkrankheiten: Unterschenkel [Fibula, Tibia, Kniegelenk]"
"E31.0","Autoimmune polyglanduläre Insuffizienz"
"H40.2","Primäres Engwinkelglaukom"
"M43.80","Sonstige näher bezeichnete Deformitäten der Wirbelsäule und des Rückens: Mehrere Lokalisationen der Wirbelsäule"
"R02.05","Nekrose der Haut und Unterhaut, anderenorts nicht klassifiziert: Beckenregion und Oberschenkel"
"R48.8","Sonstige und nicht näher bezeichnete Werkzeugstörungen"
"S31.2","Offene Wunde des Penis"
"---","Rest (2.692 Zeilen)"
"I73.1","Thrombangiitis obliterans [Endangiitis von-Winiwarter-Buerger]"
"M02.86","Sonstige reaktive Arthritiden: Unterschenkel [Fibula, Tibia, Kniegelenk]"
"I32.8","Perikarditis bei sonstigen anderenorts klassifizierten Krankheiten"
"B85.0","Pedikulose durch Pediculus humanus capitis"
"D35.3","Gutartige Neubildung: Ductus craniopharyngealis"
"D39.7","Neubildung unsicheren oder unbekannten Verhaltens: Sonstige weibliche Genitalorgane"
"F48.8","Sonstige neurotische Störungen"
"H35.1","Retinopathia praematurorum"
"M85.85","Sonstige näher bezeichnete Veränderungen der Knochendichte und -struktur: Beckenregion und Oberschenkel [Becken, Femur, Gesäß, Hüfte, Hüftgelenk, Iliosakralgelenk]"
"Q89.01","Asplenie (angeboren)"
"R74.9","Abnormer Wert nicht näher bezeichneter Serumenzyme"
"T54.2","Toxische Wirkung: Ätzende Säuren und säureähnliche Substanzen"
"C72.0","Bösartige Neubildung: Rückenmark"
"---","Rest (1.844 Zeilen)"
"Z12.0","Spezielle Verfahren zur Untersuchung auf Neubildung des Magens"
"G83.49","Cauda- (equina-) Syndrom, nicht näher bezeichnet"
"L89.38","Dekubitus 4. Grades: Sonstige Lokalisationen der unteren Extremität"
"N90.4","Leukoplakie der Vulva"
"S22.40","Rippenserienfraktur: Nicht näher bezeichnet"
"U55.20","Erfolgte Registrierung zur Lungentransplantation: Ohne Dringlichkeitsstufe U [Urgency] oder HU [High Urgency]"
"C43.4","Bösartiges Melanom der behaarten Kopfhaut und des Halses"
"C50.3","Bösartige Neubildung: Unterer innerer Quadrant der Brustdrüse"
"D30.0","Gutartige Neubildung: Niere"
"D44.8","Neubildung unsicheren oder unbekannten Verhaltens: Beteiligung mehrerer endokriner Drüsen"
"H44.1","Sonstige Endophthalmitis"
"---","Rest (1.854 Zeilen)"
"Z80.1","Bösartige Neubildung der Trachea, der Bronchien oder der Lunge in der Familienanamnese"
"A08.2","Enteritis durch Adenoviren"
"G52.3","Krankheiten des N. hypoglossus [XII. Hirnnerv]"
"J17.3","Pneumonie bei parasitären Krankheiten"
"M21.73","Unterschiedliche Extremitätenlänge (erworben): Unterarm [Radius, Ulna, Handgelenk]"
"O71.2","Inversio uteri, postpartal"
"Q68.2","Angeborene Deformität des Knies"
"---","Rest (2.720 Zeilen)"
"C43.6","Bösartiges Melanom der oberen Extremität, einschließlich Schulter"
"C53.1","Bösartige Neubildung: Ektozervix"
"---","Rest (1.819 Zeilen)"
"O32.9","Betreuung der Mutter bei Lage- und Einstellungsanomalie des Fetus, nicht näher bezeichnet"
"L23.7","Allergische Kontaktdermatitis durch Pflanzen, ausgenommen Nahrungsmittel"
"D68.01","Erworbenes Willebrand-Jürgens-Syndrom"
"F17.8","Psychische und Verhaltensstörungen durch Tabak: Sonstige psychische und Verhaltensstörungen"
"Q61.4","Nierendysplasie"
"Q93.8","Sonstige Deletionen der Autosomen"
"D84.1","Defekte im Komplementsystem"
"---","Rest (1.831 Zeilen)"
"D23.5","Sonstige gutartige Neubildungen: Haut des Rumpfes"
"I72.8","Aneurysma und Dissektion sonstiger näher bezeichneter Arterien"
"L21.8","Sonstiges seborrhoisches Ekzem"
"M53.82","Sonstige näher bezeichnete Krankheiten der Wirbelsäule und des Rückens: Zervikalbereich"
"O22.2","Oberflächliche Thrombophlebitis in der Schwangerschaft"
"R02.04","Nekrose der Haut und Unterhaut, anderenorts nicht klassifiziert: Rumpf"
"S70.88","Sonstige oberflächliche Verletzungen der Hüfte und des Oberschenkels: Sonstige"
"T85.53","Mechanische Komplikation durch Prothesen, Implantate oder Transplantate in den Gallenwegen"
"Z10","Allgemeine Reihenuntersuchung bestimmter Bevölkerungsgruppen"
"---","Rest (2.695 Zeilen)"
"J20.1","Akute Bronchitis durch Haemophilus influenzae"
"C71.3","Bösartige Neubildung: Parietallappen"
"H33.5","Sonstige Netzhautablösungen"
"J20.2","Akute Bronchitis durch Streptokokken"
"---","Rest (1.863 Zeilen)"
"R02.8","Sonstige und nicht näher bezeichnete Gangrän, anderenorts nicht klassifiziert"
"D83.9","Variabler Immundefekt, nicht näher bezeichnet"
"I97.84","Lymphödem nach medizinischen Maßnahmen am inguinalen Lymphabflussgebiet, Stadium I"
"M75.3","Tendinitis calcarea im Schulterbereich"
"---","Rest (2.696 Zeilen)"
"C41.02","Bösartige Neubildung des Knochens und des Gelenkknorpels: Maxillofazial"
"D39.2","Neubildung unsicheren oder unbekannten Verhaltens: Plazenta"
"M45.08","Spondylitis ankylosans: Sakral- und Sakrokokzygealbereich"
"H35.38","Sonstige Degeneration der Makula und des hinteren Poles"
"D36.9","Gutartige Neubildung an nicht näher bezeichneter Lokalisation"
"H44.8","Sonstige Affektionen des Augapfels"
"J96.91","Respiratorische Insuffizienz, nicht näher bezeichnet: Typ II [hyperkapnisch]"
"M41.90","Skoliose, nicht näher bezeichnet: Mehrere Lokalisationen der Wirbelsäule"
"---","Rest (2.704 Zeilen)"
"G57.6","Läsion des N. plantaris"
"N43.0","Funikulozele"
"---","Rest (1.801 Zeilen)"
"U81.40","Escherichia coli mit Multiresistenz 4MRGN"
"F10.8","Psychische und Verhaltensstörungen durch Alkohol: Sonstige psychische und Verhaltensstörungen"
"F78.0","Andere Intelligenzminderung: Keine oder geringfügige Verhaltensstörung"
"I44.6","Sonstiger und nicht näher bezeichneter Faszikelblock"
"C16.0","Bösartige Neubildung: Kardia"
"G54.5","Neuralgische Amyotrophie"
"M33.2","Polymyositis"
"---","Rest (1.850 Zeilen)"
"K59.4","Analspasmus"
"E78.3","Hyperchylomikronämie"
"G44.1","Vasomotorischer Kopfschmerz, anderenorts nicht klassifiziert"
"M21.37","Fallhand oder Hängefuß (erworben): Knöchel und Fuß [Fußwurzel, Mittelfuß, Zehen, Sprunggelenk, sonstige Gelenke des Fußes]"
"M67.17","Sonstige Sehnen- (Scheiden-) Kontraktur: Knöchel und Fuß [Fußwurzel, Mittelfuß, Zehen, Sprunggelenk, sonstige Gelenke des Fußes]"
"N11.8","Sonstige chronische tubulointerstitielle Nephritis"
"T95.1","Folgen einer Verbrennung, Verätzung oder Erfrierung des Rumpfes"
"---","Rest (2.727 Zeilen)"
"---","Rest (1.599 Zeilen)"
"S34.18","Sonstige Verletzung des lumbalen Rückenmarkes"
"G62.2","Polyneuropathie durch sonstige toxische Agenzien"
"---","Rest (2.489 Zeilen)"
"J12.9","Viruspneumonie, nicht näher bezeichnet"
"---","Rest (2.402 Zeilen)"
"---","Rest (1.511 Zeilen)"
"K72.9","Leberversagen, nicht näher bezeichnet"
"D37.4","Neubildung unsicheren oder unbekannten Verhaltens: Kolon"
"---","Rest (2.495 Zeilen)"
"J80.01","Atemnotsyndrom des Erwachsenen [ARDS]: Mildes Atemnotsyndrom des Erwachsenen [ARDS]"
"U07.9","Nicht belegte Schlüsselnummer U07.9"
"---","Rest (2.398 Zeilen)"
"A54.0","Gonokokkeninfektion des unteren Urogenitaltraktes ohne periurethralen Abszess oder Abszess der Glandulae urethrales"
"---","Rest (2.461 Zeilen)"
"---","Rest (1.586 Zeilen)"
"I48.4","Vorhofflattern, atypisch"
"S36.41","Verletzung: Duodenum"
"---","Rest (2.589 Zeilen)"
"M51.9","Bandscheibenschaden, nicht näher bezeichnet"
"D84.8","Sonstige näher bezeichnete Immundefekte"
"R44.2","Sonstige Halluzinationen"
"S56.3","Verletzung von Streck- oder Abduktormuskeln und -sehnen des Daumens in Höhe des Unterarmes"
"---","Rest (2.490 Zeilen)"
"C83.0","Kleinzelliges B-Zell-Lymphom"
"M25.58","Gelenkschmerz: Sonstige [Hals, Kopf, Rippen, Rumpf, Schädel, Wirbelsäule]"
"M87.87","Sonstige Knochennekrose: Knöchel und Fuß [Fußwurzel, Mittelfuß, Zehen, Sprunggelenk, sonstige Gelenke des Fußes]"
"---","Rest (1.680 Zeilen)"
"Z75.2","Wartezeit auf eine Untersuchung oder Behandlung"
"M85.65","Sonstige Knochenzyste: Beckenregion und Oberschenkel [Becken, Femur, Gesäß, Hüfte, Hüftgelenk, Iliosakralgelenk]"
"D51.3","Sonstige alimentäre Vitamin-B12-Mangelanämie"
"I70.29","Atherosklerose der Extremitätenarterien: Sonstige und nicht näher bezeichnet"
"L04.1","Akute Lymphadenitis am Rumpf"
"C02.1","Bösartige Neubildung: Zungenrand"
"---","Rest (1.729 Zeilen)"
"---","Rest (2.613 Zeilen)"
"E13.11","Sonstiger näher bezeichneter Diabetes mellitus: Mit Ketoazidose: Als entgleist bezeichnet"
"M33.1","Sonstige Dermatomyositis"
"---","Rest (1.627 Zeilen)"
"S01.52","Offene Wunde: Wangenschleimhaut"
"M79.56","Verbliebener Fremdkörper im Weichteilgewebe: Unterschenkel [Fibula, Tibia, Kniegelenk]"
"S62.11","Fraktur: Os lunatum"
"S63.00","Luxation des Handgelenkes: Teil nicht näher bezeichnet"
"S64.0","Verletzung des N. ulnaris in Höhe des Handgelenkes und der Hand"
"T82.3","Mechanische Komplikation durch sonstige Gefäßtransplantate"
"---","Rest (2.587 Zeilen)"
"C84.4","Peripheres T-Zell-Lymphom, nicht spezifiziert"
"---","Rest (1.713 Zeilen)"
"S02.63","Unterkieferfraktur: Processus coronoideus"
"G24.1","Idiopathische familiäre Dystonie"
"---","Rest (2.683 Zeilen)"
"C71.5","Bösartige Neubildung: Hirnventrikel"
"L20.0","Prurigo Besnier"
"---","Rest (1.715 Zeilen)"
"S22.5","Instabiler Thorax"
"O75.4","Sonstige Komplikationen bei geburtshilflichen Operationen und Maßnahmen"
"R45.2","Unglücklichsein"
"D68.20","Hereditärer Faktor-I-Mangel"
"M67.41","Ganglion: Schulterregion [Klavikula, Skapula, Akromioklavikular-, Schulter-, Sternoklavikulargelenk]"
"Q79.8","Sonstige angeborene Fehlbildungen des Muskel-Skelett-Systems"
"R19.80","Abdominales Kompartmentsyndrom"
"S85.1","Verletzung der A. tibialis (anterior) (posterior)"
"---","Rest (2.633 Zeilen)"
"N48.30","Priapismus vom Low-Flow-Typ"
"C44.5","Sonstige bösartige Neubildungen: Haut des Rumpfes"
"K43.99","Nicht näher bezeichnete Hernia ventralis ohne Einklemmung und ohne Gangrän"
"S01.50","Offene Wunde: Mund, Teil nicht näher bezeichnet"
"---","Rest (2.572 Zeilen)"
"H80.8","Sonstige Otosklerose"
"I83.2","Varizen der unteren Extremitäten mit Ulzeration und Entzündung"
"K12.20","Mund- (Boden-) Phlegmone"
"---","Rest (1.868 Zeilen)"
"A48.8","Sonstige näher bezeichnete bakterielle Krankheiten"
"F23.3","Sonstige akute vorwiegend wahnhafte psychotische Störungen"
"I89.01","Lymphödem der oberen und unteren Extremität(en), Stadium II"
"M43.6","Tortikollis"
"M79.83","Sonstige näher bezeichnete Krankheiten des Weichteilgewebes: Unterarm [Radius, Ulna, Handgelenk]"
"Q87.5","Sonstige angeborene Fehlbildungssyndrome mit sonstigen Skelettveränderungen"
"---","Rest (2.674 Zeilen)"
"C41.01","Bösartige Neubildung des Knochens und des Gelenkknorpels: Kraniofazial"
"M84.07","Frakturheilung in Fehlstellung: Knöchel und Fuß [Fußwurzel, Mittelfuß, Zehen, Sprunggelenk, sonstige Gelenke des Fußes]"
"---","Rest (1.745 Zeilen)"
"S36.16","Sonstige Verletzungen der Leber"
"N39.47","Rezidivinkontinenz"
"T81.5","Fremdkörper, der versehentlich nach einem Eingriff in einer Körperhöhle oder Operationswunde zurückgeblieben ist"
"H11.2","Narben der Konjunktiva"
"M67.21","Hypertrophie der Synovialis, anderenorts nicht klassifiziert: Schulterregion [Klavikula, Skapula, Akromioklavikular-, Schulter-, Sternoklavikulargelenk]"
"M79.58","Verbliebener Fremdkörper im Weichteilgewebe: Sonstige [Hals, Kopf, Rippen, Rumpf, Schädel, Wirbelsäule]"
"S35.88","Verletzung sonstiger Blutgefäße in Höhe des Abdomens, der Lumbosakralgegend und des Beckens"
"S93.11","Luxation einer oder mehrerer Zehen: Metatarsophalangeal (-Gelenk)"
"A19.1","Akute Miliartuberkulose mehrerer Lokalisationen"
"N03.3","Chronisches nephritisches Syndrom: Diffuse mesangioproliferative Glomerulonephritis"
"---","Rest (1.826 Zeilen)"
"E11.20","Diabetes mellitus, Typ 2: Mit Nierenkomplikationen: Nicht als entgleist bezeichnet"
